CTO,CTO Realty Growth Inc. Common Stock,464021671.0,Real Estate,Real Estate Investment Trusts,,,,,,,,,,,,,,,,,,,,,,,,,,,,,,,,,,,,,,,,,,,,,,,,,,,,,,,,,,,,,,,,,
CTOS,Custom Truck One Source Inc. Common Stock,978501960.0,Consumer Discretionary,Diversified Commercial Services,,,,,,,,,,,,,,,,,,,,,,,,,,,,,,,,,,,,,,,,,,,,,,,,,,,,,,,,,,,,,,,,,
CTRA,Coterra Energy Inc. Common Stock,17943455822.0,Energy,Oil & Gas Production,,,,,,,,,,,,,,,,,,,,,,,,,,,,,,,,,,,,,,,,,,,,,,,,,,,,,,,,,,,,,,,,,
CTRE,CareTrust REIT Inc. Common Stock,3891140328.0,Real Estate,Real Estate Investment Trusts,,,,,,,,,,,,,,,,,,,,,,,,,,,,,,,,,,,,,,,,,,,,,,,,,,,,,,,,,,,,,,,,,
CTRI,Centuri Holdings Inc. Common Stock,1440180067.0,Utilities,Oil & Gas Production,,,,,,,,,,,,,,,,,,,,,,,,,,,,,,,,,,,,,,,,,,,,,,,,,,,,,,,,,,,,,,,,,
CTRM,Castor Maritime Inc. Common Shares,47538944.0,Consumer Discretionary,Marine Transportation,,,,,,,,,,,,,,,,,,,,,,,,,,,,,,,,,,,,,,,,,,,,,,,,,,,,,,,,,,,,,,,,,
CTRN,Citi Trends Inc. Common Stock,146334931.0,Consumer Discretionary,Clothing/Shoe/Accessory Stores,,,,,,,,,,,,,,,,,,,,,,,,,,,,,,,,,,,,,,,,,,,,,,,,,,,,,,,,,,,,,,,,,
CTS,CTS Corporation Common Stock,1397707348.0,Technology,Electrical Products,,,,,,,,,,,,,,,,,,,,,,,,,,,,,,,,,,,,,,,,,,,,,,,,,,,,,,,,,,,,,,,,,
CTSH,Cognizant Technology Solutions Corporation Class A Common Stock,36792716232.0,Technology,EDP Services,,,,,,,,,,,,,,,,,,,,,,,,,,,,,,,,,,,,,,,,,,,,,,,,,,,,,,,,,,,,,,,,,
CTSO,Cytosorbents Corporation Common Stock,65167698.0,Health Care,Medical/Dental Instruments,,,,,,,,,,,,,,,,,,,,,,,,,,,,,,,,,,,,,,,,,,,,,,,,,,,,,,,,,,,,,,,,,
CTV,Innovid Corp. Common Stock,277273459.0,Technology,Computer Software: Prepackaged Software,,,,,,,,,,,,,,,,,,,,,,,,,,,,,,,,,,,,,,,,,,,,,,,,,,,,,,,,,,,,,,,,,
CTVA,Corteva Inc. Common Stock ,35950022080.0,Consumer Staples,Farming/Seeds/Milling,,,,,,,,,,,,,,,,,,,,,,,,,,,,,,,,,,,,,,,,,,,,,,,,,,,,,,,,,,,,,,,,,
CTXR,Citius Pharmaceuticals Inc. Common Stock,163780396.0,Health Care,Biotechnology: Pharmaceutical Preparations,,,,,,,,,,,,,,,,,,,,,,,,,,,,,,,,,,,,,,,,,,,,,,,,,,,,,,,,,,,,,,,,,
CUBB,Customers Bancorp Inc 5.375% Subordinated Notes Due 2034,633043585.0,Finance,Major Banks,,,,,,,,,,,,,,,,,,,,,,,,,,,,,,,,,,,,,,,,,,,,,,,,,,,,,,,,,,,,,,,,,
CUBE,CubeSmart Common Shares,10960653525.0,Real Estate,Real Estate Investment Trusts,,,,,,,,,,,,,,,,,,,,,,,,,,,,,,,,,,,,,,,,,,,,,,,,,,,,,,,,,,,,,,,,,
CUBI,Customers Bancorp Inc Common Stock,1819991208.0,Finance,Major Banks,,,,,,,,,,,,,,,,,,,,,,,,,,,,,,,,,,,,,,,,,,,,,,,,,,,,,,,,,,,,,,,,,
CUE,Cue Biopharma Inc. Common Stock,35509621.0,Health Care,Biotechnology: Pharmaceutical Preparations,,,,,,,,,,,,,,,,,,,,,,,,,,,,,,,,,,,,,,,,,,,,,,,,,,,,,,,,,,,,,,,,,
CUK,Carnival Plc ADS ADS,17817794914.0,Consumer Discretionary,Marine Transportation,,,,,,,,,,,,,,,,,,,,,,,,,,,,,,,,,,,,,,,,,,,,,,,,,,,,,,,,,,,,,,,,,
CULP,Culp Inc. Common Stock,61975418.0,Consumer Discretionary,Textiles,,,,,,,,,,,,,,,,,,,,,,,,,,,,,,,,,,,,,,,,,,,,,,,,,,,,,,,,,,,,,,,,,
CURI,CuriosityStream Inc. Class A Common Stock,56814398.0,Consumer Discretionary,Movies/Entertainment,,,,,,,,,,,,,,,,,,,,,,,,,,,,,,,,,,,,,,,,,,,,,,,,,,,,,,,,,,,,,,,,,
CURIW,CuriosityStream Inc. Warrant,1071970.0,Consumer Discretionary,Movies/Entertainment,,,,,,,,,,,,,,,,,,,,,,,,,,,,,,,,,,,,,,,,,,,,,,,,,,,,,,,,,,,,,,,,,
CURV,Torrid Holdings Inc. Common Stock,805582162.0,Consumer Discretionary,Clothing/Shoe/Accessory Stores,,,,,,,,,,,,,,,,,,,,,,,,,,,,,,,,,,,,,,,,,,,,,,,,,,,,,,,,,,,,,,,,,
CUTR,Cutera Inc. Common Stock,23885794.0,Health Care,Biotechnology: Electromedical & Electrotherapeutic Apparatus,,,,,,,,,,,,,,,,,,,,,,,,,,,,,,,,,,,,,,,,,,,,,,,,,,,,,,,,,,,,,,,,,
CUZ,Cousins Properties Incorporated Common Stock,4060621618.0,Real Estate,Real Estate Investment Trusts,,,,,,,,,,,,,,,,,,,,,,,,,,,,,,,,,,,,,,,,,,,,,,,,,,,,,,,,,,,,,,,,,
CVAC,CureVac N.V. Ordinary Shares,772760929.0,Health Care,Biotechnology: Pharmaceutical Preparations,,,,,,,,,,,,,,,,,,,,,,,,,,,,,,,,,,,,,,,,,,,,,,,,,,,,,,,,,,,,,,,,,
CVBF,CVB Financial Corporation Common Stock,2446487194.0,Finance,Major Banks,,,,,,,,,,,,,,,,,,,,,,,,,,,,,,,,,,,,,,,,,,,,,,,,,,,,,,,,,,,,,,,,,
CVCO,Cavco Industries Inc. Common Stock When Issued,3172211359.0,Consumer Discretionary,Homebuilding,,,,,,,,,,,,,,,,,,,,,,,,,,,,,,,,,,,,,,,,,,,,,,,,,,,,,,,,,,,,,,,,,
CVE,Cenovus Energy Inc Common Stock,33261341520.0,Energy,Oil & Gas Production,,,,,,,,,,,,,,,,,,,,,,,,,,,,,,,,,,,,,,,,,,,,,,,,,,,,,,,,,,,,,,,,,
CVEO,Civeo Corporation (Canada) Common Shares,390028587.0,Consumer Discretionary,Hotels/Resorts,,,,,,,,,,,,,,,,,,,,,,,,,,,,,,,,,,,,,,,,,,,,,,,,,,,,,,,,,,,,,,,,,
CVGI,Commercial Vehicle Group Inc. Common Stock,166044885.0,Consumer Discretionary,Auto Parts:O.E.M.,,,,,,,,,,,,,,,,,,,,,,,,,,,,,,,,,,,,,,,,,,,,,,,,,,,,,,,,,,,,,,,,,
CVGW,Calavo Growers Inc. Common Stock,413674208.0,Consumer Discretionary,Specialty Foods,,,,,,,,,,,,,,,,,,,,,,,,,,,,,,,,,,,,,,,,,,,,,,,,,,,,,,,,,,,,,,,,,
CVI,CVR Energy Inc. Common Stock,2561519663.0,Energy,Integrated oil Companies,,,,,,,,,,,,,,,,,,,,,,,,,,,,,,,,,,,,,,,,,,,,,,,,,,,,,,,,,,,,,,,,,
CVKD,Cadrenal Therapeutics Inc. Common Stock,6723557.0,Health Care,Biotechnology: Pharmaceutical Preparations,,,,,,,,,,,,,,,,,,,,,,,,,,,,,,,,,,,,,,,,,,,,,,,,,,,,,,,,,,,,,,,,,
CVLG,Covenant Logistics Group Inc. Class A Common Stock,682733582.0,Industrials,Trucking Freight/Courier Services,,,,,,,,,,,,,,,,,,,,,,,,,,,,,,,,,,,,,,,,,,,,,,,,,,,,,,,,,,,,,,,,,
CVLT,Commvault Systems Inc. Common Stock,5974739585.0,Technology,Computer Software: Prepackaged Software,,,,,,,,,,,,,,,,,,,,,,,,,,,,,,,,,,,,,,,,,,,,,,,,,,,,,,,,,,,,,,,,,
CVM,Cel-Sci Corporation Common Stock,62283928.0,Health Care,Biotechnology: Biological Products (No Diagnostic Substances),,,,,,,,,,,,,,,,,,,,,,,,,,,,,,,,,,,,,,,,,,,,,,,,,,,,,,,,,,,,,,,,,
CVNA,Carvana Co. Class A Common Stock,28392656158.0,Consumer Discretionary,Retail-Auto Dealers and Gas Stations,,,,,,,,,,,,,,,,,,,,,,,,,,,,,,,,,,,,,,,,,,,,,,,,,,,,,,,,,,,,,,,,,
CVR,Chicago Rivet & Machine Co. Common Stock,14501641.0,Industrials,Industrial Machinery/Components,,,,,,,,,,,,,,,,,,,,,,,,,,,,,,,,,,,,,,,,,,,,,,,,,,,,,,,,,,,,,,,,,
CVRX,CVRx Inc. Common Stock,177731590.0,Health Care,Medical/Dental Instruments,,,,,,,,,,,,,,,,,,,,,,,,,,,,,,,,,,,,,,,,,,,,,,,,,,,,,,,,,,,,,,,,,
CVS,CVS Health Corporation Common Stock,74468724699.0,Consumer Staples,Retail-Drug Stores and Proprietary Stores,,,,,,,,,,,,,,,,,,,,,,,,,,,,,,,,,,,,,,,,,,,,,,,,,,,,,,,,,,,,,,,,,
CVU,CPI Aerostructures Inc. Common Stock,30727214.0,Industrials,Military/Government/Technical,,,,,,,,,,,,,,,,,,,,,,,,,,,,,,,,,,,,,,,,,,,,,,,,,,,,,,,,,,,,,,,,,
CVV,CVD Equipment Corporation Common Stock,26206122.0,Technology,Industrial Machinery/Components,,,,,,,,,,,,,,,,,,,,,,,,,,,,,,,,,,,,,,,,,,,,,,,,,,,,,,,,,,,,,,,,,
CVX,Chevron Corporation Common Stock,274373191852.0,Energy,Integrated oil Companies,,,,,,,,,,,,,,,,,,,,,,,,,,,,,,,,,,,,,,,,,,,,,,,,,,,,,,,,,,,,,,,,,
CW,Curtiss-Wright Corporation Common Stock,10569699788.0,Technology,Industrial Machinery/Components,,,,,,,,,,,,,,,,,,,,,,,,,,,,,,,,,,,,,,,,,,,,,,,,,,,,,,,,,,,,,,,,,
CWAN,Clearwater Analytics Holdings Inc. Class A Common Stock,5838230764.0,Technology,Computer Software: Prepackaged Software,,,,,,,,,,,,,,,,,,,,,,,,,,,,,,,,,,,,,,,,,,,,,,,,,,,,,,,,,,,,,,,,,
CWBC,Community West Bancshares Common Stock,364383253.0,Finance,Major Banks,,,,,,,,,,,,,,,,,,,,,,,,,,,,,,,,,,,,,,,,,,,,,,,,,,,,,,,,,,,,,,,,,
CWCO,Consolidated Water Co. Ltd. Ordinary Shares,442893433.0,Utilities,Water Supply,,,,,,,,,,,,,,,,,,,,,,,,,,,,,,,,,,,,,,,,,,,,,,,,,,,,,,,,,,,,,,,,,
CWD,CaliberCos Inc. Class A Common Stock,12223177.0,Finance,Real Estate,,,,,,,,,,,,,,,,,,,,,,,,,,,,,,,,,,,,,,,,,,,,,,,,,,,,,,,,,,,,,,,,,
CWEN,Clearway Energy Inc. Class C Common Stock,3238560000.0,Utilities,Electric Utilities: Central,,,,,,,,,,,,,,,,,,,,,,,,,,,,,,,,,,,,,,,,,,,,,,,,,,,,,,,,,,,,,,,,,
CWH,Camping World Holdings Inc. Class A Common Stock,1735586142.0,Consumer Discretionary,Retail-Auto Dealers and Gas Stations,,,,,,,,,,,,,,,,,,,,,,,,,,,,,,,,,,,,,,,,,,,,,,,,,,,,,,,,,,,,,,,,,
CWK,Cushman & Wakefield plc Ordinary Shares,2842697594.0,Finance,Real Estate,,,,,,,,,,,,,,,,,,,,,,,,,,,,,,,,,,,,,,,,,,,,,,,,,,,,,,,,,,,,,,,,,
CWST,Casella Waste Systems Inc. Class A Common Stock,6128093830.0,Utilities,Environmental Services,,,,,,,,,,,,,,,,,,,,,,,,,,,,,,,,,,,,,,,,,,,,,,,,,,,,,,,,,,,,,,,,,
CWT,California Water Service Group Common Stock,3184561405.0,Utilities,Water Supply,,,,,,,,,,,,,,,,,,,,,,,,,,,,,,,,,,,,,,,,,,,,,,,,,,,,,,,,,,,,,,,,,
CX,Cemex S.A.B. de C.V. Sponsored ADR,17526060520.0,Industrials,Building Materials,,,,,,,,,,,,,,,,,,,,,,,,,,,,,,,,,,,,,,,,,,,,,,,,,,,,,,,,,,,,,,,,,
CXAI,CXApp Inc. Class A Common Stock,28830795.0,Technology,EDP Services,,,,,,,,,,,,,,,,,,,,,,,,,,,,,,,,,,,,,,,,,,,,,,,,,,,,,,,,,,,,,,,,,
CXAIW,CXApp Inc. Warrant,2591721.0,Technology,EDP Services,,,,,,,,,,,,,,,,,,,,,,,,,,,,,,,,,,,,,,,,,,,,,,,,,,,,,,,,,,,,,,,,,
CXDO,Crexendo Inc. Common Stock,107577209.0,Telecommunications,Telecommunications Equipment,,,,,,,,,,,,,,,,,,,,,,,,,,,,,,,,,,,,,,,,,,,,,,,,,,,,,,,,,,,,,,,,,
CXE,MFS High Income Municipal Trust Common Stock,120110043.0,Finance,Investment Managers,,,,,,,,,,,,,,,,,,,,,,,,,,,,,,,,,,,,,,,,,,,,,,,,,,,,,,,,,,,,,,,,,
CXH,MFS Investment Grade Municipal Trust Common Stock,73884087.0,Finance,Investment Managers,,,,,,,,,,,,,,,,,,,,,,,,,,,,,,,,,,,,,,,,,,,,,,,,,,,,,,,,,,,,,,,,,
CXM,Sprinklr Inc. Class A Common Stock,2434783355.0,Technology,Computer Software: Prepackaged Software,,,,,,,,,,,,,,,,,,,,,,,,,,,,,,,,,,,,,,,,,,,,,,,,,,,,,,,,,,,,,,,,,
CXT,Crane NXT Co. Common Stock,3338498257.0,Industrials,Metal Fabrications,,,,,,,,,,,,,,,,,,,,,,,,,,,,,,,,,,,,,,,,,,,,,,,,,,,,,,,,,,,,,,,,,
CXW,CoreCivic Inc. Common Stock,1445224897.0,Real Estate,Real Estate Investment Trusts,,,,,,,,,,,,,,,,,,,,,,,,,,,,,,,,,,,,,,,,,,,,,,,,,,,,,,,,,,,,,,,,,
CYBN,Cybin Inc. Common Shares,205116974.0,Health Care,Biotechnology: Pharmaceutical Preparations,,,,,,,,,,,,,,,,,,,,,,,,,,,,,,,,,,,,,,,,,,,,,,,,,,,,,,,,,,,,,,,,,
CYBR,CyberArk Software Ltd. Ordinary Shares,10438758205.0,Technology,Computer Software: Prepackaged Software,,,,,,,,,,,,,,,,,,,,,,,,,,,,,,,,,,,,,,,,,,,,,,,,,,,,,,,,,,,,,,,,,
CYCC,Cyclacel Pharmaceuticals Inc. Common Stock,2370480.0,Health Care,Biotechnology: Pharmaceutical Preparations,,,,,,,,,,,,,,,,,,,,,,,,,,,,,,,,,,,,,,,,,,,,,,,,,,,,,,,,,,,,,,,,,
CYCCP,Cyclacel Pharmaceuticals Inc. 6% Convertible Preferred Stock,15071568.0,Health Care,Biotechnology: Pharmaceutical Preparations,,,,,,,,,,,,,,,,,,,,,,,,,,,,,,,,,,,,,,,,,,,,,,,,,,,,,,,,,,,,,,,,,
CYCN,Cyclerion Therapeutics Inc. Common Stock,10488072.0,Health Care,Biotechnology: Pharmaceutical Preparations,,,,,,,,,,,,,,,,,,,,,,,,,,,,,,,,,,,,,,,,,,,,,,,,,,,,,,,,,,,,,,,,,
CYD,China Yuchai International Limited Common Stock,378143474.0,Industrials,Industrial Machinery/Components,,,,,,,,,,,,,,,,,,,,,,,,,,,,,,,,,,,,,,,,,,,,,,,,,,,,,,,,,,,,,,,,,
CYH,Community Health Systems Inc. Common Stock,693328195.0,Health Care,Hospital/Nursing Management,,,,,,,,,,,,,,,,,,,,,,,,,,,,,,,,,,,,,,,,,,,,,,,,,,,,,,,,,,,,,,,,,
CYN,Cyngn Inc. Common Stock,7048826.0,Technology,EDP Services,,,,,,,,,,,,,,,,,,,,,,,,,,,,,,,,,,,,,,,,,,,,,,,,,,,,,,,,,,,,,,,,,
CYRX,CryoPort Inc. Common Stock,399970445.0,Health Care,Biotechnology: Pharmaceutical Preparations,,,,,,,,,,,,,,,,,,,,,,,,,,,,,,,,,,,,,,,,,,,,,,,,,,,,,,,,,,,,,,,,,
CYTH,Cyclo Therapeutics Inc. Common Stock,30904999.0,Health Care,Biotechnology: Biological Products (No Diagnostic Substances),,,,,,,,,,,,,,,,,,,,,,,,,,,,,,,,,,,,,,,,,,,,,,,,,,,,,,,,,,,,,,,,,
CYTK,Cytokinetics Incorporated Common Stock,5991352875.0,Health Care,Biotechnology: Pharmaceutical Preparations,,,,,,,,,,,,,,,,,,,,,,,,,,,,,,,,,,,,,,,,,,,,,,,,,,,,,,,,,,,,,,,,,
CYTO,Altamira Therapeutics Ltd. Common Shares,3067766.0,Health Care,Biotechnology: Pharmaceutical Preparations,,,,,,,,,,,,,,,,,,,,,,,,,,,,,,,,,,,,,,,,,,,,,,,,,,,,,,,,,,,,,,,,,
CZFS,Citizens Financial Services Inc. Common Stock,226293351.0,Finance,Major Banks,,,,,,,,,,,,,,,,,,,,,,,,,,,,,,,,,,,,,,,,,,,,,,,,,,,,,,,,,,,,,,,,,
CZNC,Citizens & Northern Corp Common Stock,285380546.0,Finance,Major Banks,,,,,,,,,,,,,,,,,,,,,,,,,,,,,,,,,,,,,,,,,,,,,,,,,,,,,,,,,,,,,,,,,
CZR,Caesars Entertainment Inc. Common Stock,7714612189.0,Consumer Discretionary,Hotels/Resorts,,,,,,,,,,,,,,,,,,,,,,,,,,,,,,,,,,,,,,,,,,,,,,,,,,,,,,,,,,,,,,,,,
CZWI,Citizens Community Bancorp Inc. Common Stock,129558945.0,Finance,Savings Institutions,,,,,,,,,,,,,,,,,,,,,,,,,,,,,,,,,,,,,,,,,,,,,,,,,,,,,,,,,,,,,,,,,
D,Dominion Energy Inc. Common Stock,47006855215.0,Utilities,Electric Utilities: Central,,,,,,,,,,,,,,,,,,,,,,,,,,,,,,,,,,,,,,,,,,,,,,,,,,,,,,,,,,,,,,,,,
DAC,Danaos Corporation Common Stock,1594857502.0,Consumer Discretionary,Marine Transportation,,,,,,,,,,,,,,,,,,,,,,,,,,,,,,,,,,,,,,,,,,,,,,,,,,,,,,,,,,,,,,,,,
DADA,Dada Nexus Limited American Depositary Shares,338019636.0,Technology,Computer Software: Programming Data Processing,,,,,,,,,,,,,,,,,,,,,,,,,,,,,,,,,,,,,,,,,,,,,,,,,,,,,,,,,,,,,,,,,
DAIO,Data I/O Corporation Common Stock,21931078.0,Industrials,Electrical Products,,,,,,,,,,,,,,,,,,,,,,,,,,,,,,,,,,,,,,,,,,,,,,,,,,,,,,,,,,,,,,,,,
DAKT,Daktronics Inc. Common Stock,638427039.0,Consumer Discretionary,Miscellaneous manufacturing industries,,,,,,,,,,,,,,,,,,,,,,,,,,,,,,,,,,,,,,,,,,,,,,,,,,,,,,,,,,,,,,,,,
DAL,Delta Air Lines Inc. Common Stock,25707051834.0,Consumer Discretionary,Air Freight/Delivery Services,,,,,,,,,,,,,,,,,,,,,,,,,,,,,,,,,,,,,,,,,,,,,,,,,,,,,,,,,,,,,,,,,
DALN,DallasNews Corporation Series A Common Stock,22908657.0,Consumer Discretionary,Newspapers/Magazines,,,,,,,,,,,,,,,,,,,,,,,,,,,,,,,,,,,,,,,,,,,,,,,,,,,,,,,,,,,,,,,,,
DAN,Dana Incorporated Common Stock ,1629545099.0,Consumer Discretionary,Auto Parts:O.E.M.,,,,,,,,,,,,,,,,,,,,,,,,,,,,,,,,,,,,,,,,,,,,,,,,,,,,,,,,,,,,,,,,,
DAO,Youdao Inc. American Depositary Shares each representing one Class A Ordinary Share,405082503.0,Real Estate,Other Consumer Services,,,,,,,,,,,,,,,,,,,,,,,,,,,,,,,,,,,,,,,,,,,,,,,,,,,,,,,,,,,,,,,,,
DAR,Darling Ingredients Inc. Common Stock,5994928829.0,Consumer Staples,Packaged Foods,,,,,,,,,,,,,,,,,,,,,,,,,,,,,,,,,,,,,,,,,,,,,,,,,,,,,,,,,,,,,,,,,
DARE,Dare Bioscience Inc. Common Stock,27969035.0,Health Care,Biotechnology: Pharmaceutical Preparations,,,,,,,,,,,,,,,,,,,,,,,,,,,,,,,,,,,,,,,,,,,,,,,,,,,,,,,,,,,,,,,,,
DASH,DoorDash Inc. Class A Common Stock,47937037574.0,Consumer Discretionary,Business Services,,,,,,,,,,,,,,,,,,,,,,,,,,,,,,,,,,,,,,,,,,,,,,,,,,,,,,,,,,,,,,,,,
DATS,DatChat Inc. Common Stock,4935300.0,Telecommunications,Telecommunications Equipment,,,,,,,,,,,,,,,,,,,,,,,,,,,,,,,,,,,,,,,,,,,,,,,,,,,,,,,,,,,,,,,,,
DATSW,DatChat Inc. Series A Warrant,124285.0,Telecommunications,Telecommunications Equipment,,,,,,,,,,,,,,,,,,,,,,,,,,,,,,,,,,,,,,,,,,,,,,,,,,,,,,,,,,,,,,,,,
DAVA,Endava plc American Depositary Shares (each representing one Class A Ordinary Share),1711739314.0,Technology,EDP Services,,,,,,,,,,,,,,,,,,,,,,,,,,,,,,,,,,,,,,,,,,,,,,,,,,,,,,,,,,,,,,,,,
DAVE,Dave Inc. Class A Common Stock,412527986.0,Finance,Finance: Consumer Services,,,,,,,,,,,,,,,,,,,,,,,,,,,,,,,,,,,,,,,,,,,,,,,,,,,,,,,,,,,,,,,,,
DAVEW,Dave Inc. Warrants,449625.0,Finance,Finance: Consumer Services,,,,,,,,,,,,,,,,,,,,,,,,,,,,,,,,,,,,,,,,,,,,,,,,,,,,,,,,,,,,,,,,,
DAWN,Day One Biopharmaceuticals Inc. Common Stock,1216466837.0,Health Care,Biotechnology: Pharmaceutical Preparations,,,,,,,,,,,,,,,,,,,,,,,,,,,,,,,,,,,,,,,,,,,,,,,,,,,,,,,,,,,,,,,,,
DAY,Dayforce Inc. Common Stock,8415663000.0,Technology,Computer Software: Prepackaged Software,,,,,,,,,,,,,,,,,,,,,,,,,,,,,,,,,,,,,,,,,,,,,,,,,,,,,,,,,,,,,,,,,
DB,Deutsche Bank AG Common Stock,29335200000.0,Finance,Major Banks,,,,,,,,,,,,,,,,,,,,,,,,,,,,,,,,,,,,,,,,,,,,,,,,,,,,,,,,,,,,,,,,,
DBD,Diebold Nixdorf Incorporated Common stock,1447819385.0,Miscellaneous,Office Equipment/Supplies/Services,,,,,,,,,,,,,,,,,,,,,,,,,,,,,,,,,,,,,,,,,,,,,,,,,,,,,,,,,,,,,,,,,
DBGI,Digital Brands Group Inc. Common Stock,2264557.0,Consumer Discretionary,Clothing/Shoe/Accessory Stores,,,,,,,,,,,,,,,,,,,,,,,,,,,,,,,,,,,,,,,,,,,,,,,,,,,,,,,,,,,,,,,,,
DBGIW,Digital Brands Group Inc. Warrant,21677813.0,Consumer Discretionary,Clothing/Shoe/Accessory Stores,,,,,,,,,,,,,,,,,,,,,,,,,,,,,,,,,,,,,,,,,,,,,,,,,,,,,,,,,,,,,,,,,
DBI,Designer Brands Inc. Class A Common Stock,421962433.0,Consumer Discretionary,Clothing/Shoe/Accessory Stores,,,,,,,,,,,,,,,,,,,,,,,,,,,,,,,,,,,,,,,,,,,,,,,,,,,,,,,,,,,,,,,,,
DBRG,DigitalBridge Group Inc.,2309552414.0,Real Estate,Real Estate Investment Trusts,,,,,,,,,,,,,,,,,,,,,,,,,,,,,,,,,,,,,,,,,,,,,,,,,,,,,,,,,,,,,,,,,
DBVT,DBV Technologies S.A. American Depositary Shares,93603959.0,Health Care,Biotechnology: Biological Products (No Diagnostic Substances),,,,,,,,,,,,,,,,,,,,,,,,,,,,,,,,,,,,,,,,,,,,,,,,,,,,,,,,,,,,,,,,,
DBX,Dropbox Inc. Class A Common Stock,7429324658.0,Technology,Computer Software: Prepackaged Software,,,,,,,,,,,,,,,,,,,,,,,,,,,,,,,,,,,,,,,,,,,,,,,,,,,,,,,,,,,,,,,,,
DC,Dakota Gold Corp. Common Stock,186818626.0,Basic Materials,Metal Mining,,,,,,,,,,,,,,,,,,,,,,,,,,,,,,,,,,,,,,,,,,,,,,,,,,,,,,,,,,,,,,,,,
DCBO,Docebo Inc. Common Shares,1116596969.0,Technology,Computer Software: Prepackaged Software,,,,,,,,,,,,,,,,,,,,,,,,,,,,,,,,,,,,,,,,,,,,,,,,,,,,,,,,,,,,,,,,,
DCGO,DocGo Inc. Common Stock,330088008.0,Health Care,Medical/Nursing Services,,,,,,,,,,,,,,,,,,,,,,,,,,,,,,,,,,,,,,,,,,,,,,,,,,,,,,,,,,,,,,,,,
DCI,Donaldson Company Inc. Common Stock,8706501024.0,Industrials,Pollution Control Equipment,,,,,,,,,,,,,,,,,,,,,,,,,,,,,,,,,,,,,,,,,,,,,,,,,,,,,,,,,,,,,,,,,
DCO,Ducommun Incorporated Common Stock,889749795.0,Industrials,Military/Government/Technical,,,,,,,,,,,,,,,,,,,,,,,,,,,,,,,,,,,,,,,,,,,,,,,,,,,,,,,,,,,,,,,,,
DCOM,Dime Community Bancshares Inc. Common Stock,897869975.0,Finance,Major Banks,,,,,,,,,,,,,,,,,,,,,,,,,,,,,,,,,,,,,,,,,,,,,,,,,,,,,,,,,,,,,,,,,
DCOMG,Dime Community Bancshares Inc. 9.000% Fixed-to-Floating Rate Subordinated Notes due 2034,998023006.0,Finance,Major Banks,,,,,,,,,,,,,,,,,,,,,,,,,,,,,,,,,,,,,,,,,,,,,,,,,,,,,,,,,,,,,,,,,
DCOMP,Dime Community Bancshares Inc. Fixed-Rate Non-Cumulative Perpetual Preferred Stock Series A,741989771.0,Finance,Major Banks,,,,,,,,,,,,,,,,,,,,,,,,,,,,,,,,,,,,,,,,,,,,,,,,,,,,,,,,,,,,,,,,,
DCTH,Delcath Systems Inc. Common Stock,225620720.0,Health Care,Medical/Dental Instruments,,,,,,,,,,,,,,,,,,,,,,,,,,,,,,,,,,,,,,,,,,,,,,,,,,,,,,,,,,,,,,,,,
DD,DuPont de Nemours Inc. Common Stock,33032213341.0,Industrials,Major Chemicals,,,,,,,,,,,,,,,,,,,,,,,,,,,,,,,,,,,,,,,,,,,,,,,,,,,,,,,,,,,,,,,,,
DDC,DDC Enterprise Limited Class A Ordinary Shares,8232212.0,Consumer Staples,Packaged Foods,,,,,,,,,,,,,,,,,,,,,,,,,,,,,,,,,,,,,,,,,,,,,,,,,,,,,,,,,,,,,,,,,
DDD,3D Systems Corporation Common Stock,410976871.0,Technology,Computer Software: Prepackaged Software,,,,,,,,,,,,,,,,,,,,,,,,,,,,,,,,,,,,,,,,,,,,,,,,,,,,,,,,,,,,,,,,,
DDI,DoubleDown Interactive Co. Ltd. American Depository Shares,569864560.0,Technology,EDP Services,,,,,,,,,,,,,,,,,,,,,,,,,,,,,,,,,,,,,,,,,,,,,,,,,,,,,,,,,,,,,,,,,
DDL,Dingdong (Cayman) Limited American Depositary Shares (each two representing three Ordinary Shares),203155810.0,Consumer Discretionary,Catalog/Specialty Distribution,,,,,,,,,,,,,,,,,,,,,,,,,,,,,,,,,,,,,,,,,,,,,,,,,,,,,,,,,,,,,,,,,
DDOG,Datadog Inc. Class A Common Stock,35874997587.0,Technology,Computer Software: Prepackaged Software,,,,,,,,,,,,,,,,,,,,,,,,,,,,,,,,,,,,,,,,,,,,,,,,,,,,,,,,,,,,,,,,,
DDS,Dillard's Inc. Common Stock,5882435560.0,Consumer Discretionary,Department/Specialty Retail Stores,,,,,,,,,,,,,,,,,,,,,,,,,,,,,,,,,,,,,,,,,,,,,,,,,,,,,,,,,,,,,,,,,
DDT,Dillard's Capital Trust I,418991229.0,Consumer Discretionary,Department/Specialty Retail Stores,,,,,,,,,,,,,,,,,,,,,,,,,,,,,,,,,,,,,,,,,,,,,,,,,,,,,,,,,,,,,,,,,
DE,Deere & Company Common Stock,97482999993.0,Industrials,Industrial Machinery/Components,,,,,,,,,,,,,,,,,,,,,,,,,,,,,,,,,,,,,,,,,,,,,,,,,,,,,,,,,,,,,,,,,
DEA,Easterly Government Properties Inc. Common Stock,1391997473.0,Real Estate,Real Estate Investment Trusts,,,,,,,,,,,,,,,,,,,,,,,,,,,,,,,,,,,,,,,,,,,,,,,,,,,,,,,,,,,,,,,,,
DECK,Deckers Outdoor Corporation Common Stock,22016154198.0,Consumer Discretionary,Shoe Manufacturing,,,,,,,,,,,,,,,,,,,,,,,,,,,,,,,,,,,,,,,,,,,,,,,,,,,,,,,,,,,,,,,,,
DEI,Douglas Emmett Inc. Common Stock,2530766503.0,Real Estate,Real Estate Investment Trusts,,,,,,,,,,,,,,,,,,,,,,,,,,,,,,,,,,,,,,,,,,,,,,,,,,,,,,,,,,,,,,,,,
DELL,Dell Technologies Inc. Class C Common Stock ,72554719765.0,Technology,Computer Manufacturing,,,,,,,,,,,,,,,,,,,,,,,,,,,,,,,,,,,,,,,,,,,,,,,,,,,,,,,,,,,,,,,,,
DENN,Denny's Corporation Common Stock,338040716.0,Consumer Discretionary,Restaurants,,,,,,,,,,,,,,,,,,,,,,,,,,,,,,,,,,,,,,,,,,,,,,,,,,,,,,,,,,,,,,,,,
DEO,Diageo plc Common Stock,68595220926.0,Consumer Staples,Beverages (Production/Distribution),,,,,,,,,,,,,,,,,,,,,,,,,,,,,,,,,,,,,,,,,,,,,,,,,,,,,,,,,,,,,,,,,
DERM,Journey Medical Corporation Common Stock,104667446.0,Health Care,Biotechnology: Pharmaceutical Preparations,,,,,,,,,,,,,,,,,,,,,,,,,,,,,,,,,,,,,,,,,,,,,,,,,,,,,,,,,,,,,,,,,
DESP,Despegar.com Corp. Ordinary Shares,718380464.0,Consumer Discretionary,Transportation Services,,,,,,,,,,,,,,,,,,,,,,,,,,,,,,,,,,,,,,,,,,,,,,,,,,,,,,,,,,,,,,,,,
DFH,Dream Finders Homes Inc. Class A Common Stock,2647822498.0,Consumer Discretionary,Homebuilding,,,,,,,,,,,,,,,,,,,,,,,,,,,,,,,,,,,,,,,,,,,,,,,,,,,,,,,,,,,,,,,,,
DFIN,Donnelley Financial Solutions Inc. Common Stock ,1860465334.0,Consumer Discretionary,Other Consumer Services,,,,,,,,,,,,,,,,,,,,,,,,,,,,,,,,,,,,,,,,,,,,,,,,,,,,,,,,,,,,,,,,,
DFLI,Dragonfly Energy Holdings Corp. Common Stock (NV),38260142.0,Miscellaneous,Industrial Machinery/Components,,,,,,,,,,,,,,,,,,,,,,,,,,,,,,,,,,,,,,,,,,,,,,,,,,,,,,,,,,,,,,,,,
DFLIW,Dragonfly Energy Holdings Corp. Warrant,2807640.0,Miscellaneous,Industrial Machinery/Components,,,,,,,,,,,,,,,,,,,,,,,,,,,,,,,,,,,,,,,,,,,,,,,,,,,,,,,,,,,,,,,,,
DFS,Discover Financial Services Common Stock,32410825099.0,Finance,Finance: Consumer Services,,,,,,,,,,,,,,,,,,,,,,,,,,,,,,,,,,,,,,,,,,,,,,,,,,,,,,,,,,,,,,,,,
DG,Dollar General Corporation Common Stock,26736990737.0,Consumer Discretionary,Department/Specialty Retail Stores,,,,,,,,,,,,,,,,,,,,,,,,,,,,,,,,,,,,,,,,,,,,,,,,,,,,,,,,,,,,,,,,,
DGHI,Digihost Technology Inc. Common Subordinate Voting Shares,36900429.0,Finance,Finance: Consumer Services,,,,,,,,,,,,,,,,,,,,,,,,,,,,,,,,,,,,,,,,,,,,,,,,,,,,,,,,,,,,,,,,,
DGICA,Donegal Group Inc. Class A Common Stock,463500795.0,Finance,Property-Casualty Insurers,,,,,,,,,,,,,,,,,,,,,,,,,,,,,,,,,,,,,,,,,,,,,,,,,,,,,,,,,,,,,,,,,
DGICB,Donegal Group Inc. Class B Common Stock,429553035.0,Finance,Property-Casualty Insurers,,,,,,,,,,,,,,,,,,,,,,,,,,,,,,,,,,,,,,,,,,,,,,,,,,,,,,,,,,,,,,,,,
DGII,Digi International Inc. Common Stock,883902659.0,Telecommunications,Computer Communications Equipment,,,,,,,,,,,,,,,,,,,,,,,,,,,,,,,,,,,,,,,,,,,,,,,,,,,,,,,,,,,,,,,,,
DGLY,Digital Ally Inc. Common Stock,3743774.0,Technology,Radio And Television Broadcasting And Communications Equipment,,,,,,,,,,,,,,,,,,,,,,,,,,,,,,,,,,,,,,,,,,,,,,,,,,,,,,,,,,,,,,,,,
DGX,Quest Diagnostics Incorporated Common Stock,16706486577.0,Health Care,Medical Specialities,,,,,,,,,,,,,,,,,,,,,,,,,,,,,,,,,,,,,,,,,,,,,,,,,,,,,,,,,,,,,,,,,
DH,Definitive Healthcare Corp. Class A Common Stock,436358438.0,Technology,Computer Software: Prepackaged Software,,,,,,,,,,,,,,,,,,,,,,,,,,,,,,,,,,,,,,,,,,,,,,,,,,,,,,,,,,,,,,,,,
DHAI,DIH Holdings US Inc. Class A Common Stock,108660426.0,Health Care,Medical/Dental Instruments,,,,,,,,,,,,,,,,,,,,,,,,,,,,,,,,,,,,,,,,,,,,,,,,,,,,,,,,,,,,,,,,,
DHAIW,DIH Holding US Inc. Warrants,1921830.0,Health Care,Medical/Dental Instruments,,,,,,,,,,,,,,,,,,,,,,,,,,,,,,,,,,,,,,,,,,,,,,,,,,,,,,,,,,,,,,,,,
DHC,Diversified Healthcare Trust Common Shares of Beneficial Interest,781279597.0,Real Estate,Real Estate Investment Trusts,,,,,,,,,,,,,,,,,,,,,,,,,,,,,,,,,,,,,,,,,,,,,,,,,,,,,,,,,,,,,,,,,
DHCNI,Diversified Healthcare Trust 5.625% Senior Notes due 2042,3377531794.0,Real Estate,Real Estate Investment Trusts,,,,,,,,,,,,,,,,,,,,,,,,,,,,,,,,,,,,,,,,,,,,,,,,,,,,,,,,,,,,,,,,,
DHCNL,Diversified Healthcare Trust 6.25% Senior Notes Due 2046,3653984574.0,Real Estate,Real Estate Investment Trusts,,,,,,,,,,,,,,,,,,,,,,,,,,,,,,,,,,,,,,,,,,,,,,,,,,,,,,,,,,,,,,,,,
DHI,D.R. Horton Inc. Common Stock,57911241852.0,Consumer Discretionary,Homebuilding,,,,,,,,,,,,,,,,,,,,,,,,,,,,,,,,,,,,,,,,,,,,,,,,,,,,,,,,,,,,,,,,,
DHIL,Diamond Hill Investment Group Inc. Class A Common Stock,415156881.0,Finance,Investment Managers,,,,,,,,,,,,,,,,,,,,,,,,,,,,,,,,,,,,,,,,,,,,,,,,,,,,,,,,,,,,,,,,,
DHR,Danaher Corporation Common Stock,199872470167.0,Industrials,Industrial Machinery/Components,,,,,,,,,,,,,,,,,,,,,,,,,,,,,,,,,,,,,,,,,,,,,,,,,,,,,,,,,,,,,,,,,
DHT,DHT Holdings Inc.,1811244848.0,Consumer Discretionary,Marine Transportation,,,,,,,,,,,,,,,,,,,,,,,,,,,,,,,,,,,,,,,,,,,,,,,,,,,,,,,,,,,,,,,,,
DHX,DHI Group Inc. Common Stock,96680242.0,Consumer Discretionary,Business Services,,,,,,,,,,,,,,,,,,,,,,,,,,,,,,,,,,,,,,,,,,,,,,,,,,,,,,,,,,,,,,,,,
DIBS,1stdibs.com Inc. Common Stock,166953490.0,Consumer Discretionary,Catalog/Specialty Distribution,,,,,,,,,,,,,,,,,,,,,,,,,,,,,,,,,,,,,,,,,,,,,,,,,,,,,,,,,,,,,,,,,
DIN,Dine Brands Global Inc. Common Stock,501726812.0,Consumer Discretionary,Restaurants,,,,,,,,,,,,,,,,,,,,,,,,,,,,,,,,,,,,,,,,,,,,,,,,,,,,,,,,,,,,,,,,,
DINO,HF Sinclair Corporation Common Stock,8985281894.0,Energy,Natural Gas Distribution,,,,,,,,,,,,,,,,,,,,,,,,,,,,,,,,,,,,,,,,,,,,,,,,,,,,,,,,,,,,,,,,,
DIOD,Diodes Incorporated Common Stock,3077320155.0,Technology,Semiconductors,,,,,,,,,,,,,,,,,,,,,,,,,,,,,,,,,,,,,,,,,,,,,,,,,,,,,,,,,,,,,,,,,
DIS,Walt Disney Company (The) Common Stock,163289963839.0,Consumer Discretionary,Services-Misc. Amusement & Recreation,,,,,,,,,,,,,,,,,,,,,,,,,,,,,,,,,,,,,,,,,,,,,,,,,,,,,,,,,,,,,,,,,
