ITUB,Itau Unibanco Banco Holding SA American Depositary Shares (Each repstg 500 Preferred shares),56452991962.0,Finance,Major Banks,,,,,,,,,,,,,,,,,,,,,,,,,,,,,,,,,,,,,,,,,,,,,,,,,,,,,,,,,,,,,,,,,
ITW,Illinois Tool Works Inc. Common Stock,72764840000.0,Industrials,Industrial Machinery/Components,,,,,,,,,,,,,,,,,,,,,,,,,,,,,,,,,,,,,,,,,,,,,,,,,,,,,,,,,,,,,,,,,
IVA,Inventiva S.A. American Depository Shares,118302882.0,Health Care,Biotechnology: Pharmaceutical Preparations,,,,,,,,,,,,,,,,,,,,,,,,,,,,,,,,,,,,,,,,,,,,,,,,,,,,,,,,,,,,,,,,,
IVAC,Intevac Inc. Common Stock,95968446.0,Technology,Industrial Machinery/Components,,,,,,,,,,,,,,,,,,,,,,,,,,,,,,,,,,,,,,,,,,,,,,,,,,,,,,,,,,,,,,,,,
IVCP,Swiftmerge Acquisition Corp. Class A Ordinary Share,309093750.0,Finance,Blank Checks,,,,,,,,,,,,,,,,,,,,,,,,,,,,,,,,,,,,,,,,,,,,,,,,,,,,,,,,,,,,,,,,,
IVDA,Iveda Solutions Inc. Common Stock,7484150.0,Technology,Computer Software: Prepackaged Software,,,,,,,,,,,,,,,,,,,,,,,,,,,,,,,,,,,,,,,,,,,,,,,,,,,,,,,,,,,,,,,,,
IVDAW,Iveda Solutions Inc. Warrant,1296710.0,Technology,Computer Software: Prepackaged Software,,,,,,,,,,,,,,,,,,,,,,,,,,,,,,,,,,,,,,,,,,,,,,,,,,,,,,,,,,,,,,,,,
IVP,Inspire Veterinary Partners Inc. Class A Common Stock,8267997.0,Consumer Staples,Farming/Seeds/Milling,,,,,,,,,,,,,,,,,,,,,,,,,,,,,,,,,,,,,,,,,,,,,,,,,,,,,,,,,,,,,,,,,
IVR,INVESCO MORTGAGE CAPITAL INC Common Stock,433571275.0,Real Estate,Real Estate Investment Trusts,,,,,,,,,,,,,,,,,,,,,,,,,,,,,,,,,,,,,,,,,,,,,,,,,,,,,,,,,,,,,,,,,
IVT,InvenTrust Properties Corp. Common Stock,8493401427.0,Real Estate,Real Estate Investment Trusts,,,,,,,,,,,,,,,,,,,,,,,,,,,,,,,,,,,,,,,,,,,,,,,,,,,,,,,,,,,,,,,,,
IVVD,Invivyd Inc. Common Stock,136019997.0,Health Care,Biotechnology: Biological Products (No Diagnostic Substances),,,,,,,,,,,,,,,,,,,,,,,,,,,,,,,,,,,,,,,,,,,,,,,,,,,,,,,,,,,,,,,,,
IVZ,Invesco Ltd Common Stock,7070009412.0,Finance,Investment Managers,,,,,,,,,,,,,,,,,,,,,,,,,,,,,,,,,,,,,,,,,,,,,,,,,,,,,,,,,,,,,,,,,
IX,Orix Corp Ads Common Stock,25679416858.0,Finance,Diversified Financial Services,,,,,,,,,,,,,,,,,,,,,,,,,,,,,,,,,,,,,,,,,,,,,,,,,,,,,,,,,,,,,,,,,
IXHL,Incannex Healthcare Inc. Common Stock,29144623.0,Health Care,Biotechnology: Pharmaceutical Preparations,,,,,,,,,,,,,,,,,,,,,,,,,,,,,,,,,,,,,,,,,,,,,,,,,,,,,,,,,,,,,,,,,
IZEA,IZEA Worldwide Inc. Common Stock,34313706.0,Consumer Discretionary,Advertising,,,,,,,,,,,,,,,,,,,,,,,,,,,,,,,,,,,,,,,,,,,,,,,,,,,,,,,,,,,,,,,,,
IZM,ICZOOM Group Inc. Class A Ordinary Shares,21777332.0,Consumer Discretionary,Consumer Electronics/Video Chains,,,,,,,,,,,,,,,,,,,,,,,,,,,,,,,,,,,,,,,,,,,,,,,,,,,,,,,,,,,,,,,,,
J,Jacobs Solutions Inc. Common Stock,17810273081.0,Industrials,Military/Government/Technical,,,,,,,,,,,,,,,,,,,,,,,,,,,,,,,,,,,,,,,,,,,,,,,,,,,,,,,,,,,,,,,,,
JACK,Jack In The Box Inc. Common Stock,1057922492.0,Consumer Discretionary,Restaurants,,,,,,,,,,,,,,,,,,,,,,,,,,,,,,,,,,,,,,,,,,,,,,,,,,,,,,,,,,,,,,,,,
JAGX,Jaguar Health Inc. Common Stock,5671502.0,Health Care,Biotechnology: Pharmaceutical Preparations,,,,,,,,,,,,,,,,,,,,,,,,,,,,,,,,,,,,,,,,,,,,,,,,,,,,,,,,,,,,,,,,,
JAKK,JAKKS Pacific Inc. Common Stock,242047990.0,Consumer Discretionary,Recreational Games/Products/Toys,,,,,,,,,,,,,,,,,,,,,,,,,,,,,,,,,,,,,,,,,,,,,,,,,,,,,,,,,,,,,,,,,
JAMF,Jamf Holding Corp. Common Stock,2161876141.0,Technology,Computer Software: Prepackaged Software,,,,,,,,,,,,,,,,,,,,,,,,,,,,,,,,,,,,,,,,,,,,,,,,,,,,,,,,,,,,,,,,,
JANX,Janux Therapeutics Inc. Common Stock,2009731853.0,Health Care,Biotechnology: Pharmaceutical Preparations,,,,,,,,,,,,,,,,,,,,,,,,,,,,,,,,,,,,,,,,,,,,,,,,,,,,,,,,,,,,,,,,,
JAZZ,Jazz Pharmaceuticals plc Common Stock (Ireland),7139867135.0,Health Care,Biotechnology: Pharmaceutical Preparations,,,,,,,,,,,,,,,,,,,,,,,,,,,,,,,,,,,,,,,,,,,,,,,,,,,,,,,,,,,,,,,,,
JBGS,JBG SMITH Properties Common Shares ,1389344321.0,Real Estate,Real Estate Investment Trusts,,,,,,,,,,,,,,,,,,,,,,,,,,,,,,,,,,,,,,,,,,,,,,,,,,,,,,,,,,,,,,,,,
JBHT,J.B. Hunt Transport Services Inc. Common Stock,16683976606.0,Industrials,Trucking Freight/Courier Services,,,,,,,,,,,,,,,,,,,,,,,,,,,,,,,,,,,,,,,,,,,,,,,,,,,,,,,,,,,,,,,,,
JBI,Janus International Group Inc. Common Stock,1995521201.0,Industrials,Building Products,,,,,,,,,,,,,,,,,,,,,,,,,,,,,,,,,,,,,,,,,,,,,,,,,,,,,,,,,,,,,,,,,
JBL,Jabil Inc. Common Stock,11301410027.0,Technology,Electrical Products,,,,,,,,,,,,,,,,,,,,,,,,,,,,,,,,,,,,,,,,,,,,,,,,,,,,,,,,,,,,,,,,,
JBLU,JetBlue Airways Corporation Common Stock,1928392186.0,Consumer Discretionary,Air Freight/Delivery Services,,,,,,,,,,,,,,,,,,,,,,,,,,,,,,,,,,,,,,,,,,,,,,,,,,,,,,,,,,,,,,,,,
JBSS,John B. Sanfilippo & Son Inc. Common Stock,1210821468.0,Consumer Staples,Specialty Foods,,,,,,,,,,,,,,,,,,,,,,,,,,,,,,,,,,,,,,,,,,,,,,,,,,,,,,,,,,,,,,,,,
JBT,John Bean Technologies Corporation Common Stock,2988876653.0,Industrials,Industrial Machinery/Components,,,,,,,,,,,,,,,,,,,,,,,,,,,,,,,,,,,,,,,,,,,,,,,,,,,,,,,,,,,,,,,,,
JCI,Johnson Controls International plc Ordinary Share,45037473474.0,Industrials,Industrial Machinery/Components,,,,,,,,,,,,,,,,,,,,,,,,,,,,,,,,,,,,,,,,,,,,,,,,,,,,,,,,,,,,,,,,,
JCSE,JE Cleantech Holdings Limited Ordinary Shares,6208266.0,Consumer Discretionary,Miscellaneous manufacturing industries,,,,,,,,,,,,,,,,,,,,,,,,,,,,,,,,,,,,,,,,,,,,,,,,,,,,,,,,,,,,,,,,,
JCTCF,Jewett-Cameron Trading Company Common Shares,14369688.0,Consumer Discretionary,RETAIL: Building Materials,,,,,,,,,,,,,,,,,,,,,,,,,,,,,,,,,,,,,,,,,,,,,,,,,,,,,,,,,,,,,,,,,
JD,JD.com Inc. American Depositary Shares,39554490993.0,Consumer Discretionary,Other Specialty Stores,,,,,,,,,,,,,,,,,,,,,,,,,,,,,,,,,,,,,,,,,,,,,,,,,,,,,,,,,,,,,,,,,
JDZG,JIADE LIMITED Common stock,12929624.0,Real Estate,Other Consumer Services,,,,,,,,,,,,,,,,,,,,,,,,,,,,,,,,,,,,,,,,,,,,,,,,,,,,,,,,,,,,,,,,,
JEF,Jefferies Financial Group Inc. Common Stock,11141704832.0,Finance,Investment Bankers/Brokers/Service,,,,,,,,,,,,,,,,,,,,,,,,,,,,,,,,,,,,,,,,,,,,,,,,,,,,,,,,,,,,,,,,,
JELD,JELD-WEN Holding Inc. Common Stock,1319030885.0,Basic Materials,Forest Products,,,,,,,,,,,,,,,,,,,,,,,,,,,,,,,,,,,,,,,,,,,,,,,,,,,,,,,,,,,,,,,,,
JEQ,abrdn Japan Equity Fund Inc. Common Stock,76839944.0,Consumer Discretionary,Air Freight/Delivery Services,,,,,,,,,,,,,,,,,,,,,,,,,,,,,,,,,,,,,,,,,,,,,,,,,,,,,,,,,,,,,,,,,
JEWL,Adamas One Corp. Common Stock,12065399.0,Consumer Discretionary,Consumer Specialties,,,,,,,,,,,,,,,,,,,,,,,,,,,,,,,,,,,,,,,,,,,,,,,,,,,,,,,,,,,,,,,,,
JFBR,Jeffs' Brands Ltd Ordinary Shares,279811.0,Consumer Discretionary,Other Specialty Stores,,,,,,,,,,,,,,,,,,,,,,,,,,,,,,,,,,,,,,,,,,,,,,,,,,,,,,,,,,,,,,,,,
JFBRW,Jeffs' Brands Ltd Warrant,36465.0,Consumer Discretionary,Other Specialty Stores,,,,,,,,,,,,,,,,,,,,,,,,,,,,,,,,,,,,,,,,,,,,,,,,,,,,,,,,,,,,,,,,,
JFIN,Jiayin Group Inc. American Depositary Shares,277890227.0,Finance,Finance: Consumer Services,,,,,,,,,,,,,,,,,,,,,,,,,,,,,,,,,,,,,,,,,,,,,,,,,,,,,,,,,,,,,,,,,
JFU,9F Inc. American Depositary Shares,23546666.0,Finance,Finance: Consumer Services,,,,,,,,,,,,,,,,,,,,,,,,,,,,,,,,,,,,,,,,,,,,,,,,,,,,,,,,,,,,,,,,,
JG,Aurora Mobile Limited American Depositary Shares,16327390.0,Technology,Computer Software: Programming Data Processing,,,,,,,,,,,,,,,,,,,,,,,,,,,,,,,,,,,,,,,,,,,,,,,,,,,,,,,,,,,,,,,,,
JHG,Janus Henderson Group plc Ordinary Shares,5758975653.0,Finance,Investment Managers,,,,,,,,,,,,,,,,,,,,,,,,,,,,,,,,,,,,,,,,,,,,,,,,,,,,,,,,,,,,,,,,,
JHI,John Hancock Investors Trust Common Stock,118794671.0,Finance,Trusts Except Educational Religious and Charitable,,,,,,,,,,,,,,,,,,,,,,,,,,,,,,,,,,,,,,,,,,,,,,,,,,,,,,,,,,,,,,,,,
JHS,John Hancock Income Securities Trust Common Stock,134285125.0,Finance,Finance Companies,,,,,,,,,,,,,,,,,,,,,,,,,,,,,,,,,,,,,,,,,,,,,,,,,,,,,,,,,,,,,,,,,
JHX,James Hardie Industries plc American Depositary Shares (Ireland),14674934168.0,Industrials,Building Materials,,,,,,,,,,,,,,,,,,,,,,,,,,,,,,,,,,,,,,,,,,,,,,,,,,,,,,,,,,,,,,,,,
JILL,J. Jill Inc. Common Stock,374025076.0,Consumer Discretionary,Apparel,,,,,,,,,,,,,,,,,,,,,,,,,,,,,,,,,,,,,,,,,,,,,,,,,,,,,,,,,,,,,,,,,
JJSF,J & J Snack Foods Corp. Common Stock,3227029349.0,Consumer Staples,Specialty Foods,,,,,,,,,,,,,,,,,,,,,,,,,,,,,,,,,,,,,,,,,,,,,,,,,,,,,,,,,,,,,,,,,
JKHY,Jack Henry & Associates Inc. Common Stock,12408313425.0,Technology,EDP Services,,,,,,,,,,,,,,,,,,,,,,,,,,,,,,,,,,,,,,,,,,,,,,,,,,,,,,,,,,,,,,,,,
JKS,JinkoSolar Holding Company Limited American Depositary Shares (each representing 4 Common Shares),1040062348.0,Technology,Semiconductors,,,,,,,,,,,,,,,,,,,,,,,,,,,,,,,,,,,,,,,,,,,,,,,,,,,,,,,,,,,,,,,,,
JL,J-Long Group Limited Ordinary Shares,12588260.0,Consumer Discretionary,Clothing/Shoe/Accessory Stores,,,,,,,,,,,,,,,,,,,,,,,,,,,,,,,,,,,,,,,,,,,,,,,,,,,,,,,,,,,,,,,,,
JLL,Jones Lang LaSalle Incorporated Common Stock,11380287686.0,Finance,Real Estate,,,,,,,,,,,,,,,,,,,,,,,,,,,,,,,,,,,,,,,,,,,,,,,,,,,,,,,,,,,,,,,,,
JMIA,Jumia Technologies AG American Depositary Shares each representing two Ordinary Shares,1081172521.0,Consumer Discretionary,Catalog/Specialty Distribution,,,,,,,,,,,,,,,,,,,,,,,,,,,,,,,,,,,,,,,,,,,,,,,,,,,,,,,,,,,,,,,,,
JMSB,John Marshall Bancorp Inc. Common Stock,265934682.0,Finance,Major Banks,,,,,,,,,,,,,,,,,,,,,,,,,,,,,,,,,,,,,,,,,,,,,,,,,,,,,,,,,,,,,,,,,
JNJ,Johnson & Johnson Common Stock,395124975501.0,Health Care,Biotechnology: Pharmaceutical Preparations,,,,,,,,,,,,,,,,,,,,,,,,,,,,,,,,,,,,,,,,,,,,,,,,,,,,,,,,,,,,,,,,,
JNPR,Juniper Networks Inc. Common Stock,12574044860.0,Telecommunications,Computer Communications Equipment,,,,,,,,,,,,,,,,,,,,,,,,,,,,,,,,,,,,,,,,,,,,,,,,,,,,,,,,,,,,,,,,,
JNVR,Janover Inc. Common Stock,6860037.0,Finance,Finance: Consumer Services,,,,,,,,,,,,,,,,,,,,,,,,,,,,,,,,,,,,,,,,,,,,,,,,,,,,,,,,,,,,,,,,,
JOB,GEE Group Inc. Common Stock,33469015.0,Consumer Discretionary,Diversified Commercial Services,,,,,,,,,,,,,,,,,,,,,,,,,,,,,,,,,,,,,,,,,,,,,,,,,,,,,,,,,,,,,,,,,
JOBY,Joby Aviation Inc. Common Stock,3577625591.0,Industrials,Aerospace,,,,,,,,,,,,,,,,,,,,,,,,,,,,,,,,,,,,,,,,,,,,,,,,,,,,,,,,,,,,,,,,,
JOE,St. Joe Company (The) Common Stock,3449540679.0,Real Estate,Homebuilding,,,,,,,,,,,,,,,,,,,,,,,,,,,,,,,,,,,,,,,,,,,,,,,,,,,,,,,,,,,,,,,,,
JOUT,Johnson Outdoors Inc. Class A Common Stock,417616405.0,Consumer Discretionary,Recreational Games/Products/Toys,,,,,,,,,,,,,,,,,,,,,,,,,,,,,,,,,,,,,,,,,,,,,,,,,,,,,,,,,,,,,,,,,
JPI,Nuveen Preferred and Income Term Fund Common Shares of Beneficial Interest,452260241.0,Finance,Finance Companies,,,,,,,,,,,,,,,,,,,,,,,,,,,,,,,,,,,,,,,,,,,,,,,,,,,,,,,,,,,,,,,,,
JPM,JP Morgan Chase & Co. Common Stock,571863941424.0,Finance,Major Banks,,,,,,,,,,,,,,,,,,,,,,,,,,,,,,,,,,,,,,,,,,,,,,,,,,,,,,,,,,,,,,,,,
JRSH,Jerash Holdings (US) Inc. Common Stock,36515675.0,Consumer Discretionary,Apparel,,,,,,,,,,,,,,,,,,,,,,,,,,,,,,,,,,,,,,,,,,,,,,,,,,,,,,,,,,,,,,,,,
JRVR,James River Group Holdings Ltd. Common Shares,294662725.0,Finance,Property-Casualty Insurers,,,,,,,,,,,,,,,,,,,,,,,,,,,,,,,,,,,,,,,,,,,,,,,,,,,,,,,,,,,,,,,,,
JSM,Navient Corporation 6% Senior Notes due December 15 2043,2184919577.0,Finance,Finance: Consumer Services,,,,,,,,,,,,,,,,,,,,,,,,,,,,,,,,,,,,,,,,,,,,,,,,,,,,,,,,,,,,,,,,,
JSPR,Jasper Therapeutics Inc. Common Stock,253739001.0,Health Care,Biotechnology: Biological Products (No Diagnostic Substances),,,,,,,,,,,,,,,,,,,,,,,,,,,,,,,,,,,,,,,,,,,,,,,,,,,,,,,,,,,,,,,,,
JSPRW,Japer Therapeutics Inc. Warrants,3281108.0,Health Care,Biotechnology: Biological Products (No Diagnostic Substances),,,,,,,,,,,,,,,,,,,,,,,,,,,,,,,,,,,,,,,,,,,,,,,,,,,,,,,,,,,,,,,,,
JTAI,Jet.AI Inc. Common Stock,3367358.0,Consumer Discretionary,Transportation Services,,,,,,,,,,,,,,,,,,,,,,,,,,,,,,,,,,,,,,,,,,,,,,,,,,,,,,,,,,,,,,,,,
JTAIW,Jet.AI Inc. Warrant,1373729.0,Consumer Discretionary,Transportation Services,,,,,,,,,,,,,,,,,,,,,,,,,,,,,,,,,,,,,,,,,,,,,,,,,,,,,,,,,,,,,,,,,
JTAIZ,Jet.AI Inc. Merger Consideration Warrants,3558685.0,Consumer Discretionary,Transportation Services,,,,,,,,,,,,,,,,,,,,,,,,,,,,,,,,,,,,,,,,,,,,,,,,,,,,,,,,,,,,,,,,,
JVA,Coffee Holding Co. Inc. Common Stock,12444746.0,Consumer Staples,Packaged Foods,,,,,,,,,,,,,,,,,,,,,,,,,,,,,,,,,,,,,,,,,,,,,,,,,,,,,,,,,,,,,,,,,
JWEL,Jowell Global Ltd. Ordinary Shares,2927971.0,Consumer Discretionary,Other Consumer Services,,,,,,,,,,,,,,,,,,,,,,,,,,,,,,,,,,,,,,,,,,,,,,,,,,,,,,,,,,,,,,,,,
JWN,Nordstrom Inc. Common Stock,3457898721.0,Consumer Discretionary,Clothing/Shoe/Accessory Stores,,,,,,,,,,,,,,,,,,,,,,,,,,,,,,,,,,,,,,,,,,,,,,,,,,,,,,,,,,,,,,,,,
JXJT,JX Luxventure Limited Common Stock,10095215.0,Consumer Staples,Apparel,,,,,,,,,,,,,,,,,,,,,,,,,,,,,,,,,,,,,,,,,,,,,,,,,,,,,,,,,,,,,,,,,
JXN,Jackson Financial Inc. Class A Common Stock ,5806767533.0,Finance,Life Insurance,,,,,,,,,,,,,,,,,,,,,,,,,,,,,,,,,,,,,,,,,,,,,,,,,,,,,,,,,,,,,,,,,
JYD,Jayud Global Logistics Limited Class A Ordinary Shares,13665423.0,Consumer Discretionary,Oil Refining/Marketing,,,,,,,,,,,,,,,,,,,,,,,,,,,,,,,,,,,,,,,,,,,,,,,,,,,,,,,,,,,,,,,,,
JYNT,The Joint Corp. Common Stock,190617874.0,Miscellaneous,Multi-Sector Companies,,,,,,,,,,,,,,,,,,,,,,,,,,,,,,,,,,,,,,,,,,,,,,,,,,,,,,,,,,,,,,,,,
JZ,Jianzhi Education Technology Group Company Limited American Depositary Shs,15845225.0,Real Estate,Other Consumer Services,,,,,,,,,,,,,,,,,,,,,,,,,,,,,,,,,,,,,,,,,,,,,,,,,,,,,,,,,,,,,,,,,
JZXN,Jiuzi Holdings Inc. Ordinary Shares,16478276.0,Consumer Discretionary,Retail-Auto Dealers and Gas Stations,,,,,,,,,,,,,,,,,,,,,,,,,,,,,,,,,,,,,,,,,,,,,,,,,,,,,,,,,,,,,,,,,
K,Kellanova Common Stock,21531831962.0,Consumer Staples,Packaged Foods,,,,,,,,,,,,,,,,,,,,,,,,,,,,,,,,,,,,,,,,,,,,,,,,,,,,,,,,,,,,,,,,,
KA,Kineta Inc. Common Stock,6887004.0,Health Care,Biotechnology: Pharmaceutical Preparations,,,,,,,,,,,,,,,,,,,,,,,,,,,,,,,,,,,,,,,,,,,,,,,,,,,,,,,,,,,,,,,,,
KAI,Kadant Inc Common Stock,3635263793.0,Industrials,Industrial Machinery/Components,,,,,,,,,,,,,,,,,,,,,,,,,,,,,,,,,,,,,,,,,,,,,,,,,,,,,,,,,,,,,,,,,
KALA,KALA BIO Inc. Common Stock,16617079.0,Health Care,Biotechnology: Pharmaceutical Preparations,,,,,,,,,,,,,,,,,,,,,,,,,,,,,,,,,,,,,,,,,,,,,,,,,,,,,,,,,,,,,,,,,
KALU,Kaiser Aluminum Corporation Common Stock,1126419582.0,Industrials,Metal Fabrications,,,,,,,,,,,,,,,,,,,,,,,,,,,,,,,,,,,,,,,,,,,,,,,,,,,,,,,,,,,,,,,,,
KALV,KalVista Pharmaceuticals Inc. Common Stock,562828471.0,Health Care,Biotechnology: Pharmaceutical Preparations,,,,,,,,,,,,,,,,,,,,,,,,,,,,,,,,,,,,,,,,,,,,,,,,,,,,,,,,,,,,,,,,,
KAR,OPENLANE Inc. Common Stock,1905032373.0,Consumer Discretionary,Retail-Auto Dealers and Gas Stations,,,,,,,,,,,,,,,,,,,,,,,,,,,,,,,,,,,,,,,,,,,,,,,,,,,,,,,,,,,,,,,,,
KARO,Karooooo Ltd. Ordinary Shares,1124142000.0,Technology,Computer Software: Prepackaged Software,,,,,,,,,,,,,,,,,,,,,,,,,,,,,,,,,,,,,,,,,,,,,,,,,,,,,,,,,,,,,,,,,
KAVL,Kaival Brands Innovations Group Inc. Common Stock,2404922.0,Consumer Discretionary,Other Consumer Services,,,,,,,,,,,,,,,,,,,,,,,,,,,,,,,,,,,,,,,,,,,,,,,,,,,,,,,,,,,,,,,,,
KB,KB Financial Group Inc,22803135542.0,Finance,Commercial Banks,,,,,,,,,,,,,,,,,,,,,,,,,,,,,,,,,,,,,,,,,,,,,,,,,,,,,,,,,,,,,,,,,
KBH,KB Home Common Stock,6098273628.0,Consumer Discretionary,Homebuilding,,,,,,,,,,,,,,,,,,,,,,,,,,,,,,,,,,,,,,,,,,,,,,,,,,,,,,,,,,,,,,,,,
KBR,KBR Inc. Common Stock,8689507256.0,Industrials,Military/Government/Technical,,,,,,,,,,,,,,,,,,,,,,,,,,,,,,,,,,,,,,,,,,,,,,,,,,,,,,,,,,,,,,,,,
KC,Kingsoft Cloud Holdings Limited American Depositary Shares,621529850.0,Technology,Computer Software: Prepackaged Software,,,,,,,,,,,,,,,,,,,,,,,,,,,,,,,,,,,,,,,,,,,,,,,,,,,,,,,,,,,,,,,,,
KD,Kyndryl Holdings Inc. Common Stock,5389404157.0,Technology,EDP Services,,,,,,,,,,,,,,,,,,,,,,,,,,,,,,,,,,,,,,,,,,,,,,,,,,,,,,,,,,,,,,,,,
KDLY,Kindly MD Inc. Common Stock,9622016.0,Health Care,Medical/Nursing Services,,,,,,,,,,,,,,,,,,,,,,,,,,,,,,,,,,,,,,,,,,,,,,,,,,,,,,,,,,,,,,,,,
KDLYW,Kindly MD Inc. Warrants,1632179.0,Health Care,Medical/Nursing Services,,,,,,,,,,,,,,,,,,,,,,,,,,,,,,,,,,,,,,,,,,,,,,,,,,,,,,,,,,,,,,,,,
KDP,Keurig Dr Pepper Inc. Common Stock,47557949241.0,Consumer Staples,Beverages (Production/Distribution),,,,,,,,,,,,,,,,,,,,,,,,,,,,,,,,,,,,,,,,,,,,,,,,,,,,,,,,,,,,,,,,,
KE,Kimball Electronics Inc. Common Stock,520761174.0,Technology,Electrical Products,,,,,,,,,,,,,,,,,,,,,,,,,,,,,,,,,,,,,,,,,,,,,,,,,,,,,,,,,,,,,,,,,
KELYA,Kelly Services Inc. Class A Common Stock,778991298.0,Consumer Discretionary,Professional Services,,,,,,,,,,,,,,,,,,,,,,,,,,,,,,,,,,,,,,,,,,,,,,,,,,,,,,,,,,,,,,,,,
KELYB,Kelly Services Inc. Class B Common Stock,787161293.0,Consumer Discretionary,Professional Services,,,,,,,,,,,,,,,,,,,,,,,,,,,,,,,,,,,,,,,,,,,,,,,,,,,,,,,,,,,,,,,,,
KEN,Kenon Holdings Ltd. Ordinary Shares,1262159012.0,Utilities,Electric Utilities: Central,,,,,,,,,,,,,,,,,,,,,,,,,,,,,,,,,,,,,,,,,,,,,,,,,,,,,,,,,,,,,,,,,
KEP,Korea Electric Power Corporation Common Stock,9334157680.0,Utilities,Electric Utilities: Central,,,,,,,,,,,,,,,,,,,,,,,,,,,,,,,,,,,,,,,,,,,,,,,,,,,,,,,,,,,,,,,,,
KEQU,Kewaunee Scientific Corporation Common Stock,145614132.0,Industrials,Medical Specialities,,,,,,,,,,,,,,,,,,,,,,,,,,,,,,,,,,,,,,,,,,,,,,,,,,,,,,,,,,,,,,,,,
KEX,Kirby Corporation Common Stock,6411834000.0,Consumer Discretionary,Marine Transportation,,,,,,,,,,,,,,,,,,,,,,,,,,,,,,,,,,,,,,,,,,,,,,,,,,,,,,,,,,,,,,,,,
KEY,KeyCorp Common Stock,13629178342.0,Finance,Major Banks,,,,,,,,,,,,,,,,,,,,,,,,,,,,,,,,,,,,,,,,,,,,,,,,,,,,,,,,,,,,,,,,,
KEYS,Keysight Technologies Inc. Common Stock,22114121455.0,Industrials,Industrial Machinery/Components,,,,,,,,,,,,,,,,,,,,,,,,,,,,,,,,,,,,,,,,,,,,,,,,,,,,,,,,,,,,,,,,,
KFFB,Kentucky First Federal Bancorp Common Stock,27049708.0,Finance,Savings Institutions,,,,,,,,,,,,,,,,,,,,,,,,,,,,,,,,,,,,,,,,,,,,,,,,,,,,,,,,,,,,,,,,,
KFRC,Kforce Inc. Common Stock,1266417650.0,Consumer Discretionary,Professional Services,,,,,,,,,,,,,,,,,,,,,,,,,,,,,,,,,,,,,,,,,,,,,,,,,,,,,,,,,,,,,,,,,
KFS,Kingsway Financial Services Inc. Common Stock (DE),233423514.0,Finance,Property-Casualty Insurers,,,,,,,,,,,,,,,,,,,,,,,,,,,,,,,,,,,,,,,,,,,,,,,,,,,,,,,,,,,,,,,,,
KFY,Korn Ferry Common Stock,3630704640.0,Consumer Discretionary,Diversified Commercial Services,,,,,,,,,,,,,,,,,,,,,,,,,,,,,,,,,,,,,,,,,,,,,,,,,,,,,,,,,,,,,,,,,
KGC,Kinross Gold Corporation Common Stock,10753750000.0,Basic Materials,Precious Metals,,,,,,,,,,,,,,,,,,,,,,,,,,,,,,,,,,,,,,,,,,,,,,,,,,,,,,,,,,,,,,,,,
KGEI,Kolibri Global Energy Inc. Common stock,110439320.0,Energy,Oil & Gas Production,,,,,,,,,,,,,,,,,,,,,,,,,,,,,,,,,,,,,,,,,,,,,,,,,,,,,,,,,,,,,,,,,
KGS,Kodiak Gas Services Inc. Common Stock,2265826510.0,Utilities,Natural Gas Distribution,,,,,,,,,,,,,,,,,,,,,,,,,,,,,,,,,,,,,,,,,,,,,,,,,,,,,,,,,,,,,,,,,
KHC,The Kraft Heinz Company Common Stock,43599385026.0,Consumer Staples,Packaged Foods,,,,,,,,,,,,,,,,,,,,,,,,,,,,,,,,,,,,,,,,,,,,,,,,,,,,,,,,,,,,,,,,,
KIDS,OrthoPediatrics Corp. Common Stock,704381752.0,Health Care,Medical/Dental Instruments,,,,,,,,,,,,,,,,,,,,,,,,,,,,,,,,,,,,,,,,,,,,,,,,,,,,,,,,,,,,,,,,,
KIM,Kimco Realty Corporation (HC) Common Stock,14783373749.0,Real Estate,Real Estate Investment Trusts,,,,,,,,,,,,,,,,,,,,,,,,,,,,,,,,,,,,,,,,,,,,,,,,,,,,,,,,,,,,,,,,,
KIND,Nextdoor Holdings Inc. Class A Common Stock,1042052142.0,Technology,Computer Software: Programming Data Processing,,,,,,,,,,,,,,,,,,,,,,,,,,,,,,,,,,,,,,,,,,,,,,,,,,,,,,,,,,,,,,,,,
KINS,Kingstone Companies Inc. Common Stock,74304243.0,Finance,Property-Casualty Insurers,,,,,,,,,,,,,,,,,,,,,,,,,,,,,,,,,,,,,,,,,,,,,,,,,,,,,,,,,,,,,,,,,
KIRK,Kirkland's Inc. COMMONSTOCK,20862365.0,Consumer Discretionary,Other Specialty Stores,,,,,,,,,,,,,,,,,,,,,,,,,,,,,,,,,,,,,,,,,,,,,,,,,,,,,,,,,,,,,,,,,
KITT,Nauticus Robotics Inc. Common stock,8397786.0,Industrials,Industrial Machinery/Components,,,,,,,,,,,,,,,,,,,,,,,,,,,,,,,,,,,,,,,,,,,,,,,,,,,,,,,,,,,,,,,,,
KITTW,Nauticus Robotics Inc. Warrant,72720.0,Industrials,Industrial Machinery/Components,,,,,,,,,,,,,,,,,,,,,,,,,,,,,,,,,,,,,,,,,,,,,,,,,,,,,,,,,,,,,,,,,
KKR,KKR & Co. Inc. Common Stock,96389574175.0,Finance,Investment Managers,,,,,,,,,,,,,,,,,,,,,,,,,,,,,,,,,,,,,,,,,,,,,,,,,,,,,,,,,,,,,,,,,
KLAC,KLA Corporation Common Stock,93732294688.0,Technology,Electronic Components,,,,,,,,,,,,,,,,,,,,,,,,,,,,,,,,,,,,,,,,,,,,,,,,,,,,,,,,,,,,,,,,,
KLG,WK Kellogg Co Common Stock,1495127762.0,Consumer Staples,Packaged Foods,,,,,,,,,,,,,,,,,,,,,,,,,,,,,,,,,,,,,,,,,,,,,,,,,,,,,,,,,,,,,,,,,
KLIC,Kulicke and Soffa Industries Inc. Common Stock,2258481131.0,Technology,Semiconductors,,,,,,,,,,,,,,,,,,,,,,,,,,,,,,,,,,,,,,,,,,,,,,,,,,,,,,,,,,,,,,,,,
KLTR,Kaltura Inc. Common Stock,170416975.0,Technology,Computer Software: Prepackaged Software,,,,,,,,,,,,,,,,,,,,,,,,,,,,,,,,,,,,,,,,,,,,,,,,,,,,,,,,,,,,,,,,,
KLXE,KLX Energy Services Holdings Inc. Common Stock,101878148.0,Energy,Oilfield Services/Equipment,,,,,,,,,,,,,,,,,,,,,,,,,,,,,,,,,,,,,,,,,,,,,,,,,,,,,,,,,,,,,,,,,
KMB,Kimberly-Clark Corporation Common Stock,47186300223.0,Consumer Discretionary,Containers/Packaging,,,,,,,,,,,,,,,,,,,,,,,,,,,,,,,,,,,,,,,,,,,,,,,,,,,,,,,,,,,,,,,,,
KMDA,Kamada Ltd. Ordinary Shares,241239200.0,Health Care,Biotechnology: Pharmaceutical Preparations,,,,,,,,,,,,,,,,,,,,,,,,,,,,,,,,,,,,,,,,,,,,,,,,,,,,,,,,,,,,,,,,,
KMI,Kinder Morgan Inc. Common Stock,45898486878.0,Utilities,Natural Gas Distribution,,,,,,,,,,,,,,,,,,,,,,,,,,,,,,,,,,,,,,,,,,,,,,,,,,,,,,,,,,,,,,,,,
KMPB,Kemper Corporation 5.875% Fixed-Rate Reset Junior Subordinated Debentures due 2062,1449089174.0,Finance,Property-Casualty Insurers,,,,,,,,,,,,,,,,,,,,,,,,,,,,,,,,,,,,,,,,,,,,,,,,,,,,,,,,,,,,,,,,,
KMPR,Kemper Corporation,4098778662.0,Finance,Property-Casualty Insurers,,,,,,,,,,,,,,,,,,,,,,,,,,,,,,,,,,,,,,,,,,,,,,,,,,,,,,,,,,,,,,,,,
KMT,Kennametal Inc. Common Stock,1907648318.0,Industrials,Industrial Machinery/Components,,,,,,,,,,,,,,,,,,,,,,,,,,,,,,,,,,,,,,,,,,,,,,,,,,,,,,,,,,,,,,,,,
KMX,CarMax Inc,12233468258.0,Consumer Discretionary,Retail-Auto Dealers and Gas Stations,,,,,,,,,,,,,,,,,,,,,,,,,,,,,,,,,,,,,,,,,,,,,,,,,,,,,,,,,,,,,,,,,
KN,Knowles Corporation Common Stock,1516527903.0,Consumer Staples,Consumer Electronics/Appliances,,,,,,,,,,,,,,,,,,,,,,,,,,,,,,,,,,,,,,,,,,,,,,,,,,,,,,,,,,,,,,,,,
KNDI,Kandi Technologies Group Inc. Ordinary Shares,160739151.0,Consumer Discretionary,Auto Manufacturing,,,,,,,,,,,,,,,,,,,,,,,,,,,,,,,,,,,,,,,,,,,,,,,,,,,,,,,,,,,,,,,,,
KNF,Knife Riv Holding Co. Common Stock,4149491303.0,Industrials,Mining & Quarrying of Nonmetallic Minerals (No Fuels),,,,,,,,,,,,,,,,,,,,,,,,,,,,,,,,,,,,,,,,,,,,,,,,,,,,,,,,,,,,,,,,,
KNOP,KNOT Offshore Partners LP Common Units representing Limited Partner Interests,232187452.0,Consumer Discretionary,Marine Transportation,,,,,,,,,,,,,,,,,,,,,,,,,,,,,,,,,,,,,,,,,,,,,,,,,,,,,,,,,,,,,,,,,
KNSA,Kiniksa Pharmaceuticals International plc Class A Ordinary Shares,1788929608.0,Health Care,Biotechnology: Pharmaceutical Preparations,,,,,,,,,,,,,,,,,,,,,,,,,,,,,,,,,,,,,,,,,,,,,,,,,,,,,,,,,,,,,,,,,
KNSL,Kinsale Capital Group Inc. Common Stock,10424167256.0,Finance,Property-Casualty Insurers,,,,,,,,,,,,,,,,,,,,,,,,,,,,,,,,,,,,,,,,,,,,,,,,,,,,,,,,,,,,,,,,,
KNTK,Kinetik Holdings Inc. Class A Common Stock,6190883761.0,Utilities,Natural Gas Distribution,,,,,,,,,,,,,,,,,,,,,,,,,,,,,,,,,,,,,,,,,,,,,,,,,,,,,,,,,,,,,,,,,
KNW,Know Labs Inc. Common Stock,28620922.0,Industrials,Industrial Machinery/Components,,,,,,,,,,,,,,,,,,,,,,,,,,,,,,,,,,,,,,,,,,,,,,,,,,,,,,,,,,,,,,,,,
KNX,Knight-Swift Transportation Holdings Inc.,8211360720.0,Industrials,Trucking Freight/Courier Services,,,,,,,,,,,,,,,,,,,,,,,,,,,,,,,,,,,,,,,,,,,,,,,,,,,,,,,,,,,,,,,,,
KO,Coca-Cola Company (The) Common Stock,298803158840.0,Consumer Staples,Beverages (Production/Distribution),,,,,,,,,,,,,,,,,,,,,,,,,,,,,,,,,,,,,,,,,,,,,,,,,,,,,,,,,,,,,,,,,
KOD,Kodiak Sciences Inc Common Stock,140793658.0,Health Care,Biotechnology: Biological Products (No Diagnostic Substances),,,,,,,,,,,,,,,,,,,,,,,,,,,,,,,,,,,,,,,,,,,,,,,,,,,,,,,,,,,,,,,,,
KODK,Eastman Kodak Company Common New,407709000.0,Consumer Discretionary,Industrial Machinery/Components,,,,,,,,,,,,,,,,,,,,,,,,,,,,,,,,,,,,,,,,,,,,,,,,,,,,,,,,,,,,,,,,,
KOF,Coca Cola Femsa S.A.B. de C.V.  American Depositary Shares each representing 10 Units (each Unit consists of 3 Series B Shares and 5 Series L Shares),18388584772.0,Consumer Staples,Beverages (Production/Distribution),,,,,,,,,,,,,,,,,,,,,,,,,,,,,,,,,,,,,,,,,,,,,,,,,,,,,,,,,,,,,,,,,
KOP,Koppers Holdings Inc. Common Stock,773170710.0,Basic Materials,Forest Products,,,,,,,,,,,,,,,,,,,,,,,,,,,,,,,,,,,,,,,,,,,,,,,,,,,,,,,,,,,,,,,,,
KOPN,Kopin Corporation Common Stock,102227050.0,Technology,Semiconductors,,,,,,,,,,,,,,,,,,,,,,,,,,,,,,,,,,,,,,,,,,,,,,,,,,,,,,,,,,,,,,,,,
KORE,KORE Group Holdings Inc. Common Stock,51249253.0,Telecommunications,Telecommunications Equipment,,,,,,,,,,,,,,,,,,,,,,,,,,,,,,,,,,,,,,,,,,,,,,,,,,,,,,,,,,,,,,,,,
KOS,Kosmos Energy Ltd. Common Shares (DE),2305872204.0,Energy,Oil & Gas Production,,,,,,,,,,,,,,,,,,,,,,,,,,,,,,,,,,,,,,,,,,,,,,,,,,,,,,,,,,,,,,,,,
KOSS,Koss Corporation Common Stock,76352059.0,Consumer Staples,Consumer Electronics/Appliances,,,,,,,,,,,,,,,,,,,,,,,,,,,,,,,,,,,,,,,,,,,,,,,,,,,,,,,,,,,,,,,,,
KPLT,Katapult Holdings Inc. Common Stock,72054070.0,Consumer Discretionary,Diversified Commercial Services,,,,,,,,,,,,,,,,,,,,,,,,,,,,,,,,,,,,,,,,,,,,,,,,,,,,,,,,,,,,,,,,,
KPLTW,Katapult Holdings Inc. Warrant,52963.0,Consumer Discretionary,Diversified Commercial Services,,,,,,,,,,,,,,,,,,,,,,,,,,,,,,,,,,,,,,,,,,,,,,,,,,,,,,,,,,,,,,,,,
KPRX,Kiora Pharmaceuticals Inc.  Common Stock,13100205.0,Health Care,Biotechnology: Pharmaceutical Preparations,,,,,,,,,,,,,,,,,,,,,,,,,,,,,,,,,,,,,,,,,,,,,,,,,,,,,,,,,,,,,,,,,
KPTI,Karyopharm Therapeutics Inc. Common Stock,104762134.0,Health Care,Biotechnology: Pharmaceutical Preparations,,,,,,,,,,,,,,,,,,,,,,,,,,,,,,,,,,,,,,,,,,,,,,,,,,,,,,,,,,,,,,,,,
KR,Kroger Company (The) Common Stock,39214895740.0,Consumer Staples,Food Chains,,,,,,,,,,,,,,,,,,,,,,,,,,,,,,,,,,,,,,,,,,,,,,,,,,,,,,,,,,,,,,,,,
