QUIK,QuickLogic Corporation Common Stock,137749420.0,Technology,Semiconductors,,,,,,,,,,,,,,,,,,,,,,,,,,,,,,,,,,,,,,,,,,,,,,,,,,,,,,,,,,,,,,,,,
QURE,uniQure N.V. Ordinary Shares,354896384.0,Health Care,Biotechnology: Pharmaceutical Preparations,,,,,,,,,,,,,,,,,,,,,,,,,,,,,,,,,,,,,,,,,,,,,,,,,,,,,,,,,,,,,,,,,
QVCC,QVC Inc. 6.250% Senior Secured Notes due 2068,11.0,Consumer Discretionary,Catalog/Specialty Distribution,,,,,,,,,,,,,,,,,,,,,,,,,,,,,,,,,,,,,,,,,,,,,,,,,,,,,,,,,,,,,,,,,
QVCD,QVC Inc. 6.375% Senior Secured Notes due 2067,12.0,Consumer Discretionary,Catalog/Specialty Distribution,,,,,,,,,,,,,,,,,,,,,,,,,,,,,,,,,,,,,,,,,,,,,,,,,,,,,,,,,,,,,,,,,
QXO,QXO Inc. Common Stock,7966732.0,Technology,EDP Services,,,,,,,,,,,,,,,,,,,,,,,,,,,,,,,,,,,,,,,,,,,,,,,,,,,,,,,,,,,,,,,,,
R,Ryder System Inc. Common Stock,5675723787.0,Consumer Discretionary,Rental/Leasing Companies,,,,,,,,,,,,,,,,,,,,,,,,,,,,,,,,,,,,,,,,,,,,,,,,,,,,,,,,,,,,,,,,,
RACE,Ferrari N.V. Common Shares,105687979614.0,Consumer Discretionary,Auto Manufacturing,,,,,,,,,,,,,,,,,,,,,,,,,,,,,,,,,,,,,,,,,,,,,,,,,,,,,,,,,,,,,,,,,
RAIL,FreightCar America Inc. Common Stock,61370722.0,Industrials,Railroads,,,,,,,,,,,,,,,,,,,,,,,,,,,,,,,,,,,,,,,,,,,,,,,,,,,,,,,,,,,,,,,,,
RAMP,LiveRamp Holdings Inc. Common Stock,1902585014.0,Technology,EDP Services,,,,,,,,,,,,,,,,,,,,,,,,,,,,,,,,,,,,,,,,,,,,,,,,,,,,,,,,,,,,,,,,,
RAND,Rand Capital Corporation Common Stock,44329036.0,Finance,Finance: Consumer Services,,,,,,,,,,,,,,,,,,,,,,,,,,,,,,,,,,,,,,,,,,,,,,,,,,,,,,,,,,,,,,,,,
RANI,Rani Therapeutics Holdings Inc. Class A Common Stock,134622241.0,Health Care,Biotechnology: Pharmaceutical Preparations,,,,,,,,,,,,,,,,,,,,,,,,,,,,,,,,,,,,,,,,,,,,,,,,,,,,,,,,,,,,,,,,,
RAPP,Rapport Therapeutics Inc. Common Stock,781112171.0,Health Care,Biotechnology: Pharmaceutical Preparations,,,,,,,,,,,,,,,,,,,,,,,,,,,,,,,,,,,,,,,,,,,,,,,,,,,,,,,,,,,,,,,,,
RAPT,RAPT Therapeutics Inc. Common Stock,103314289.0,Health Care,Biotechnology: Pharmaceutical Preparations,,,,,,,,,,,,,,,,,,,,,,,,,,,,,,,,,,,,,,,,,,,,,,,,,,,,,,,,,,,,,,,,,
RARE,Ultragenyx Pharmaceutical Inc. Common Stock,4195739720.0,Health Care,Biotechnology: Pharmaceutical Preparations,,,,,,,,,,,,,,,,,,,,,,,,,,,,,,,,,,,,,,,,,,,,,,,,,,,,,,,,,,,,,,,,,
RAVE,Rave Restaurant Group Inc. Common Stock,25964087.0,Consumer Discretionary,Food Distributors,,,,,,,,,,,,,,,,,,,,,,,,,,,,,,,,,,,,,,,,,,,,,,,,,,,,,,,,,,,,,,,,,
RAY,Raytech Holding Limited Ordinary Shares,57506716.0,Consumer Discretionary,Consumer Electronics/Appliances,,,,,,,,,,,,,,,,,,,,,,,,,,,,,,,,,,,,,,,,,,,,,,,,,,,,,,,,,,,,,,,,,
RAYA,Erayak Power Solution Group Inc. Class A Ordinary Shares,10209000.0,Consumer Discretionary,Metal Fabrications,,,,,,,,,,,,,,,,,,,,,,,,,,,,,,,,,,,,,,,,,,,,,,,,,,,,,,,,,,,,,,,,,
RBA,RB Global Inc. Common Stock,13736572055.0,Consumer Discretionary,Business Services,,,,,,,,,,,,,,,,,,,,,,,,,,,,,,,,,,,,,,,,,,,,,,,,,,,,,,,,,,,,,,,,,
RBB,RBB Bancorp Common Stock,392777836.0,Finance,Major Banks,,,,,,,,,,,,,,,,,,,,,,,,,,,,,,,,,,,,,,,,,,,,,,,,,,,,,,,,,,,,,,,,,
RBBN,Ribbon Communications Inc. Common Stock,520089256.0,Technology,EDP Services,,,,,,,,,,,,,,,,,,,,,,,,,,,,,,,,,,,,,,,,,,,,,,,,,,,,,,,,,,,,,,,,,
RBC,RBC Bearings Incorporated Common Stock,8078471299.0,Industrials,Metal Fabrications,,,,,,,,,,,,,,,,,,,,,,,,,,,,,,,,,,,,,,,,,,,,,,,,,,,,,,,,,,,,,,,,,
RBCAA,Republic Bancorp Inc. Class A Common Stock,1177350779.0,Finance,Major Banks,,,,,,,,,,,,,,,,,,,,,,,,,,,,,,,,,,,,,,,,,,,,,,,,,,,,,,,,,,,,,,,,,
RBCP,RBC Bearings Incorporated 5.00% Series A Mandatory Convertible Preferred Stock,3624868933.0,Industrials,Metal Fabrications,,,,,,,,,,,,,,,,,,,,,,,,,,,,,,,,,,,,,,,,,,,,,,,,,,,,,,,,,,,,,,,,,
RBKB,Rhinebeck Bancorp Inc. Common Stock,94006433.0,Finance,Banks,,,,,,,,,,,,,,,,,,,,,,,,,,,,,,,,,,,,,,,,,,,,,,,,,,,,,,,,,,,,,,,,,
RBLX,Roblox Corporation Class A Common Stock,24985600000.0,Technology,Computer Software: Prepackaged Software,,,,,,,,,,,,,,,,,,,,,,,,,,,,,,,,,,,,,,,,,,,,,,,,,,,,,,,,,,,,,,,,,
RBOT,Vicarious Surgical Inc. Class A Common Stock,35217696.0,Health Care,Industrial Specialties,,,,,,,,,,,,,,,,,,,,,,,,,,,,,,,,,,,,,,,,,,,,,,,,,,,,,,,,,,,,,,,,,
RBRK,Rubrik Inc. Class A Common Stock,5591007507.0,Technology,Computer Software: Prepackaged Software,,,,,,,,,,,,,,,,,,,,,,,,,,,,,,,,,,,,,,,,,,,,,,,,,,,,,,,,,,,,,,,,,
RC,Ready Capital Corproation Common Stock,1523239033.0,Real Estate,Real Estate Investment Trusts,,,,,,,,,,,,,,,,,,,,,,,,,,,,,,,,,,,,,,,,,,,,,,,,,,,,,,,,,,,,,,,,,
RCAT,Red Cat Holdings Inc. Common Stock,144848964.0,Technology,Computer Software: Prepackaged Software,,,,,,,,,,,,,,,,,,,,,,,,,,,,,,,,,,,,,,,,,,,,,,,,,,,,,,,,,,,,,,,,,
RCB,Ready Capital Corporation 6.20% Senior Notes due 2026,4056341638.0,Real Estate,Real Estate Investment Trusts,,,,,,,,,,,,,,,,,,,,,,,,,,,,,,,,,,,,,,,,,,,,,,,,,,,,,,,,,,,,,,,,,
RCC,Ready Capital Corporation 5.75% Senior Notes due 2026,4039454287.0,Real Estate,Real Estate Investment Trusts,,,,,,,,,,,,,,,,,,,,,,,,,,,,,,,,,,,,,,,,,,,,,,,,,,,,,,,,,,,,,,,,,
RCEL,Avita Medical Inc. Common Stock,212847814.0,Health Care,Medical/Dental Instruments,,,,,,,,,,,,,,,,,,,,,,,,,,,,,,,,,,,,,,,,,,,,,,,,,,,,,,,,,,,,,,,,,
RCI,Rogers Communication Inc. Common Stock,20538688238.0,Telecommunications,Cable & Other Pay Television Services,,,,,,,,,,,,,,,,,,,,,,,,,,,,,,,,,,,,,,,,,,,,,,,,,,,,,,,,,,,,,,,,,
RCKT,Rocket Pharmaceuticals Inc. Common Stock,1895078655.0,Health Care,Biotechnology: Pharmaceutical Preparations,,,,,,,,,,,,,,,,,,,,,,,,,,,,,,,,,,,,,,,,,,,,,,,,,,,,,,,,,,,,,,,,,
RCKY,Rocky Brands Inc. Common Stock,218093058.0,Consumer Discretionary,Shoe Manufacturing,,,,,,,,,,,,,,,,,,,,,,,,,,,,,,,,,,,,,,,,,,,,,,,,,,,,,,,,,,,,,,,,,
RCL,Royal Caribbean Cruises Ltd. Common Stock,35742814348.0,Consumer Discretionary,Marine Transportation,,,,,,,,,,,,,,,,,,,,,,,,,,,,,,,,,,,,,,,,,,,,,,,,,,,,,,,,,,,,,,,,,
RCM,R1 RCM Inc. Common Stock,5918635982.0,Consumer Discretionary,Other Consumer Services,,,,,,,,,,,,,,,,,,,,,,,,,,,,,,,,,,,,,,,,,,,,,,,,,,,,,,,,,,,,,,,,,
RCMT,RCM Technologies Inc. Common Stock,144214505.0,Consumer Discretionary,Professional Services,,,,,,,,,,,,,,,,,,,,,,,,,,,,,,,,,,,,,,,,,,,,,,,,,,,,,,,,,,,,,,,,,
RCON,Recon Technology Ltd. Class A Ordinary Shares,26061643.0,Energy,Oilfield Services/Equipment,,,,,,,,,,,,,,,,,,,,,,,,,,,,,,,,,,,,,,,,,,,,,,,,,,,,,,,,,,,,,,,,,
RCRT,Recruiter.com Group Inc. Common Stock,5674885.0,Technology,EDP Services,,,,,,,,,,,,,,,,,,,,,,,,,,,,,,,,,,,,,,,,,,,,,,,,,,,,,,,,,,,,,,,,,
RCUS,Arcus Biosciences Inc. Common Stock,1368842816.0,Health Care,Biotechnology: Pharmaceutical Preparations,,,,,,,,,,,,,,,,,,,,,,,,,,,,,,,,,,,,,,,,,,,,,,,,,,,,,,,,,,,,,,,,,
RDCM,Radcom Ltd. Ordinary Shares,152311933.0,Technology,Computer peripheral equipment,,,,,,,,,,,,,,,,,,,,,,,,,,,,,,,,,,,,,,,,,,,,,,,,,,,,,,,,,,,,,,,,,
RDDT,Reddit Inc. Class A Common Stock,9414862960.0,Technology,EDP Services,,,,,,,,,,,,,,,,,,,,,,,,,,,,,,,,,,,,,,,,,,,,,,,,,,,,,,,,,,,,,,,,,
RDFN,Redfin Corporation Common Stock,882889811.0,Finance,Real Estate,,,,,,,,,,,,,,,,,,,,,,,,,,,,,,,,,,,,,,,,,,,,,,,,,,,,,,,,,,,,,,,,,
RDHL,Redhill Biopharma Ltd. American Depositary Shares,20350263.0,Health Care,Biotechnology: Pharmaceutical Preparations,,,,,,,,,,,,,,,,,,,,,,,,,,,,,,,,,,,,,,,,,,,,,,,,,,,,,,,,,,,,,,,,,
RDI,Reading International Inc Class A Common Stock,30499916.0,Consumer Discretionary,Movies/Entertainment,,,,,,,,,,,,,,,,,,,,,,,,,,,,,,,,,,,,,,,,,,,,,,,,,,,,,,,,,,,,,,,,,
RDIB,Reading International Inc Class B Common Stock,302756522.0,Consumer Discretionary,Movies/Entertainment,,,,,,,,,,,,,,,,,,,,,,,,,,,,,,,,,,,,,,,,,,,,,,,,,,,,,,,,,,,,,,,,,
RDN,Radian Group Inc. Common Stock,5261211567.0,Finance,Property-Casualty Insurers,,,,,,,,,,,,,,,,,,,,,,,,,,,,,,,,,,,,,,,,,,,,,,,,,,,,,,,,,,,,,,,,,
RDNT,RadNet Inc. Common Stock,4088527224.0,Health Care,Medical Specialities,,,,,,,,,,,,,,,,,,,,,,,,,,,,,,,,,,,,,,,,,,,,,,,,,,,,,,,,,,,,,,,,,
RDUS,Radius Recycling Inc. Class A Common Stock,442462584.0,Consumer Discretionary,Industrial Specialties,,,,,,,,,,,,,,,,,,,,,,,,,,,,,,,,,,,,,,,,,,,,,,,,,,,,,,,,,,,,,,,,,
RDVT,Red Violet Inc. Common Stock ,325688480.0,Technology,Computer Software: Prepackaged Software,,,,,,,,,,,,,,,,,,,,,,,,,,,,,,,,,,,,,,,,,,,,,,,,,,,,,,,,,,,,,,,,,
RDW,Redwire Corporation Common Stock,411178599.0,Industrials,Military/Government/Technical,,,,,,,,,,,,,,,,,,,,,,,,,,,,,,,,,,,,,,,,,,,,,,,,,,,,,,,,,,,,,,,,,
RDWR,Radware Ltd. Ordinary Shares,928216980.0,Consumer Discretionary,Business Services,,,,,,,,,,,,,,,,,,,,,,,,,,,,,,,,,,,,,,,,,,,,,,,,,,,,,,,,,,,,,,,,,
RDY,Dr. Reddy's Laboratories Ltd Common Stock,13879279731.0,Health Care,Biotechnology: Pharmaceutical Preparations,,,,,,,,,,,,,,,,,,,,,,,,,,,,,,,,,,,,,,,,,,,,,,,,,,,,,,,,,,,,,,,,,
RDZN,Roadzen Inc. Ordinary Shares,100265814.0,Finance,Specialty Insurers,,,,,,,,,,,,,,,,,,,,,,,,,,,,,,,,,,,,,,,,,,,,,,,,,,,,,,,,,,,,,,,,,
RDZNW,Roadzen Inc. Warrants,5386293.0,Finance,Specialty Insurers,,,,,,,,,,,,,,,,,,,,,,,,,,,,,,,,,,,,,,,,,,,,,,,,,,,,,,,,,,,,,,,,,
REAL,The RealReal Inc. Common Stock,350758002.0,Consumer Discretionary,Other Specialty Stores,,,,,,,,,,,,,,,,,,,,,,,,,,,,,,,,,,,,,,,,,,,,,,,,,,,,,,,,,,,,,,,,,
REAX,The Real Brokerage Inc. Common Shares,1052508000.0,Finance,Real Estate,,,,,,,,,,,,,,,,,,,,,,,,,,,,,,,,,,,,,,,,,,,,,,,,,,,,,,,,,,,,,,,,,
REBN,Reborn Coffee Inc. Common Stock,11311524.0,Consumer Discretionary,Restaurants,,,,,,,,,,,,,,,,,,,,,,,,,,,,,,,,,,,,,,,,,,,,,,,,,,,,,,,,,,,,,,,,,
RECT,Rectitude Holdings Ltd Ordinary Shares,47098900.0,Consumer Discretionary,Industrial Machinery/Components,,,,,,,,,,,,,,,,,,,,,,,,,,,,,,,,,,,,,,,,,,,,,,,,,,,,,,,,,,,,,,,,,
REE,REE Automotive Ltd. Class A Ordinary Shares,42460097.0,Consumer Discretionary,Auto Manufacturing,,,,,,,,,,,,,,,,,,,,,,,,,,,,,,,,,,,,,,,,,,,,,,,,,,,,,,,,,,,,,,,,,
REFI,Chicago Atlantic Real Estate Finance Inc. Common Stock,301975458.0,Real Estate,Real Estate Investment Trusts,,,,,,,,,,,,,,,,,,,,,,,,,,,,,,,,,,,,,,,,,,,,,,,,,,,,,,,,,,,,,,,,,
REFR,Research Frontiers Incorporated Common Stock,62343084.0,Miscellaneous,Multi-Sector Companies,,,,,,,,,,,,,,,,,,,,,,,,,,,,,,,,,,,,,,,,,,,,,,,,,,,,,,,,,,,,,,,,,
REG,Regency Centers Corporation Common Stock,12988122377.0,Real Estate,Real Estate Investment Trusts,,,,,,,,,,,,,,,,,,,,,,,,,,,,,,,,,,,,,,,,,,,,,,,,,,,,,,,,,,,,,,,,,
REGCO,Regency Centers Corporation 5.875% Series B Cumulative Redeemable Preferred Stock,4100248051.0,Real Estate,Real Estate Investment Trusts,,,,,,,,,,,,,,,,,,,,,,,,,,,,,,,,,,,,,,,,,,,,,,,,,,,,,,,,,,,,,,,,,
REGCP,Regency Centers Corporation 6.25% Series A Cumulative Redeemable Preferred Stock,4320135171.0,Real Estate,Real Estate Investment Trusts,,,,,,,,,,,,,,,,,,,,,,,,,,,,,,,,,,,,,,,,,,,,,,,,,,,,,,,,,,,,,,,,,
REGN,Regeneron Pharmaceuticals Inc. Common Stock,119241649492.0,Health Care,Biotechnology: Pharmaceutical Preparations,,,,,,,,,,,,,,,,,,,,,,,,,,,,,,,,,,,,,,,,,,,,,,,,,,,,,,,,,,,,,,,,,
REI,Ring Energy Inc. Common Stock,336493665.0,Energy,Oil & Gas Production,,,,,,,,,,,,,,,,,,,,,,,,,,,,,,,,,,,,,,,,,,,,,,,,,,,,,,,,,,,,,,,,,
REKR,Rekor Systems Inc. Common Stock,139133951.0,Telecommunications,Telecommunications Equipment,,,,,,,,,,,,,,,,,,,,,,,,,,,,,,,,,,,,,,,,,,,,,,,,,,,,,,,,,,,,,,,,,
RELI,Reliance Global Group Inc. Common Stock,4461865.0,Finance,Specialty Insurers,,,,,,,,,,,,,,,,,,,,,,,,,,,,,,,,,,,,,,,,,,,,,,,,,,,,,,,,,,,,,,,,,
RELIW,Reliance Global Group Inc. Series A Warrants,61970.0,Finance,Specialty Insurers,,,,,,,,,,,,,,,,,,,,,,,,,,,,,,,,,,,,,,,,,,,,,,,,,,,,,,,,,,,,,,,,,
RELL,Richardson Electronics Ltd. Common Stock,163059796.0,Technology,Electronic Components,,,,,,,,,,,,,,,,,,,,,,,,,,,,,,,,,,,,,,,,,,,,,,,,,,,,,,,,,,,,,,,,,
RELX,RELX PLC PLC American Depositary Shares (Each representing One Ordinary Share),86000024159.0,Consumer Discretionary,Business Services,,,,,,,,,,,,,,,,,,,,,,,,,,,,,,,,,,,,,,,,,,,,,,,,,,,,,,,,,,,,,,,,,
RELY,Remitly Global Inc. Common Stock,2618732394.0,Consumer Discretionary,Business Services,,,,,,,,,,,,,,,,,,,,,,,,,,,,,,,,,,,,,,,,,,,,,,,,,,,,,,,,,,,,,,,,,
RENB,Renovaro Inc. Common Stock,76260056.0,Health Care,Biotechnology: Pharmaceutical Preparations,,,,,,,,,,,,,,,,,,,,,,,,,,,,,,,,,,,,,,,,,,,,,,,,,,,,,,,,,,,,,,,,,
RENT,Rent the Runway Inc. Class A Common Stock,42725966.0,Consumer Discretionary,Other Specialty Stores,,,,,,,,,,,,,,,,,,,,,,,,,,,,,,,,,,,,,,,,,,,,,,,,,,,,,,,,,,,,,,,,,
REPL,Replimune Group Inc. Common Stock,620292561.0,Health Care,Biotechnology: Biological Products (No Diagnostic Substances),,,,,,,,,,,,,,,,,,,,,,,,,,,,,,,,,,,,,,,,,,,,,,,,,,,,,,,,,,,,,,,,,
REPX,Riley Exploration Permian Inc. Common Stock,548505097.0,Energy,Oil & Gas Production,,,,,,,,,,,,,,,,,,,,,,,,,,,,,,,,,,,,,,,,,,,,,,,,,,,,,,,,,,,,,,,,,
RERE,ATRenew Inc. American Depositary Shares (every three of which representing two Class A ordinary shares),188757080.0,Consumer Discretionary,Other Specialty Stores,,,,,,,,,,,,,,,,,,,,,,,,,,,,,,,,,,,,,,,,,,,,,,,,,,,,,,,,,,,,,,,,,
RES,RPC Inc. Common Stock,1459910866.0,Energy,Oilfield Services/Equipment,,,,,,,,,,,,,,,,,,,,,,,,,,,,,,,,,,,,,,,,,,,,,,,,,,,,,,,,,,,,,,,,,
RETO,ReTo Eco-Solutions Inc. Common Shares,4587857.0,Industrials,Industrial Machinery/Components,,,,,,,,,,,,,,,,,,,,,,,,,,,,,,,,,,,,,,,,,,,,,,,,,,,,,,,,,,,,,,,,,
REVB,Revelation Biosciences Inc. Common Stock,2416744.0,Health Care,Biotechnology: Pharmaceutical Preparations,,,,,,,,,,,,,,,,,,,,,,,,,,,,,,,,,,,,,,,,,,,,,,,,,,,,,,,,,,,,,,,,,
REVBW,Revelation Biosciences Inc. Warrant,22861.0,Health Care,Biotechnology: Pharmaceutical Preparations,,,,,,,,,,,,,,,,,,,,,,,,,,,,,,,,,,,,,,,,,,,,,,,,,,,,,,,,,,,,,,,,,
REVG,REV Group Inc. Common Stock,1386116536.0,Consumer Discretionary,Auto Manufacturing,,,,,,,,,,,,,,,,,,,,,,,,,,,,,,,,,,,,,,,,,,,,,,,,,,,,,,,,,,,,,,,,,
REX,REX American Resources Corporation,818825191.0,Industrials,Major Chemicals,,,,,,,,,,,,,,,,,,,,,,,,,,,,,,,,,,,,,,,,,,,,,,,,,,,,,,,,,,,,,,,,,
REXR,Rexford Industrial Realty Inc. Common Stock,10792408561.0,Real Estate,Real Estate Investment Trusts,,,,,,,,,,,,,,,,,,,,,,,,,,,,,,,,,,,,,,,,,,,,,,,,,,,,,,,,,,,,,,,,,
REYN,Reynolds Consumer Products Inc. Common Stock,6026752247.0,Consumer Discretionary,Containers/Packaging,,,,,,,,,,,,,,,,,,,,,,,,,,,,,,,,,,,,,,,,,,,,,,,,,,,,,,,,,,,,,,,,,
REZI,Resideo Technologies Inc. Common Stock ,2964143598.0,Industrials,Wholesale Distributors,,,,,,,,,,,,,,,,,,,,,,,,,,,,,,,,,,,,,,,,,,,,,,,,,,,,,,,,,,,,,,,,,
RF,Regions Financial Corporation Common Stock,19122469827.0,Finance,Major Banks,,,,,,,,,,,,,,,,,,,,,,,,,,,,,,,,,,,,,,,,,,,,,,,,,,,,,,,,,,,,,,,,,
RFI,Cohen & Steers Total Return Realty Fund Inc. Common Stock,615215623.0,Finance,Investment Managers,,,,,,,,,,,,,,,,,,,,,,,,,,,,,,,,,,,,,,,,,,,,,,,,,,,,,,,,,,,,,,,,,
RFIL,RF Industries Ltd. Common Stock,39778127.0,Technology,Electrical Products,,,,,,,,,,,,,,,,,,,,,,,,,,,,,,,,,,,,,,,,,,,,,,,,,,,,,,,,,,,,,,,,,
RFL,Rafael Holdings Inc. Class B Common Stock,37832666.0,Finance,Real Estate,,,,,,,,,,,,,,,,,,,,,,,,,,,,,,,,,,,,,,,,,,,,,,,,,,,,,,,,,,,,,,,,,
RFM,RiverNorth Flexible Municipal Income Fund Inc. Common Stock,97346008.0,Finance,Finance/Investors Services,,,,,,,,,,,,,,,,,,,,,,,,,,,,,,,,,,,,,,,,,,,,,,,,,,,,,,,,,,,,,,,,,
RFMZ,RiverNorth Flexible Municipal Income Fund II Inc. Common Stock,347499558.0,Finance,Trusts Except Educational Religious and Charitable,,,,,,,,,,,,,,,,,,,,,,,,,,,,,,,,,,,,,,,,,,,,,,,,,,,,,,,,,,,,,,,,,
RGA,Reinsurance Group of America Incorporated Common Stock,13573552678.0,Finance,Life Insurance,,,,,,,,,,,,,,,,,,,,,,,,,,,,,,,,,,,,,,,,,,,,,,,,,,,,,,,,,,,,,,,,,
RGC,Regencell Bioscience Holdings Limited Ordinary Shares,98897782.0,Health Care, Medicinal Chemicals and Botanical Products ,,,,,,,,,,,,,,,,,,,,,,,,,,,,,,,,,,,,,,,,,,,,,,,,,,,,,,,,,,,,,,,,,
RGCO,RGC Resources Inc. Common Stock,211563466.0,Utilities,Oil & Gas Production,,,,,,,,,,,,,,,,,,,,,,,,,,,,,,,,,,,,,,,,,,,,,,,,,,,,,,,,,,,,,,,,,
RGEN,Repligen Corporation Common Stock,9054570532.0,Health Care,Biotechnology: Biological Products (No Diagnostic Substances),,,,,,,,,,,,,,,,,,,,,,,,,,,,,,,,,,,,,,,,,,,,,,,,,,,,,,,,,,,,,,,,,
RGF,The Real Good Food Company Inc. Class A Common Stock,16168418.0,Consumer Staples,Packaged Foods,,,,,,,,,,,,,,,,,,,,,,,,,,,,,,,,,,,,,,,,,,,,,,,,,,,,,,,,,,,,,,,,,
RGLD,Royal Gold Inc. Common Stock,8848984806.0,Industrials,Precious Metals,,,,,,,,,,,,,,,,,,,,,,,,,,,,,,,,,,,,,,,,,,,,,,,,,,,,,,,,,,,,,,,,,
RGLS,Regulus Therapeutics Inc. Common Stock,102781425.0,Health Care,Biotechnology: Pharmaceutical Preparations,,,,,,,,,,,,,,,,,,,,,,,,,,,,,,,,,,,,,,,,,,,,,,,,,,,,,,,,,,,,,,,,,
RGNX,REGENXBIO Inc. Common Stock,642297797.0,Health Care,Biotechnology: Biological Products (No Diagnostic Substances),,,,,,,,,,,,,,,,,,,,,,,,,,,,,,,,,,,,,,,,,,,,,,,,,,,,,,,,,,,,,,,,,
RGP,Resources Connection Inc. Common Stock,377551688.0,Consumer Discretionary,Business Services,,,,,,,,,,,,,,,,,,,,,,,,,,,,,,,,,,,,,,,,,,,,,,,,,,,,,,,,,,,,,,,,,
RGR,Sturm Ruger & Company Inc. Common Stock,730502158.0,Industrials,Ordnance And Accessories,,,,,,,,,,,,,,,,,,,,,,,,,,,,,,,,,,,,,,,,,,,,,,,,,,,,,,,,,,,,,,,,,
RGS,Regis Corporation Common Stock,54695953.0,Consumer Discretionary,Other Consumer Services,,,,,,,,,,,,,,,,,,,,,,,,,,,,,,,,,,,,,,,,,,,,,,,,,,,,,,,,,,,,,,,,,
RGT,Royce Global Trust Inc. Common Stock,70516896.0,Finance,Trusts Except Educational Religious and Charitable,,,,,,,,,,,,,,,,,,,,,,,,,,,,,,,,,,,,,,,,,,,,,,,,,,,,,,,,,,,,,,,,,
RGTI,Rigetti Computing Inc. Common Stock,154245992.0,Technology,EDP Services,,,,,,,,,,,,,,,,,,,,,,,,,,,,,,,,,,,,,,,,,,,,,,,,,,,,,,,,,,,,,,,,,
RGTIW,Rigetti Computing Inc. Warrants,19839487.0,Technology,EDP Services,,,,,,,,,,,,,,,,,,,,,,,,,,,,,,,,,,,,,,,,,,,,,,,,,,,,,,,,,,,,,,,,,
RH,RH Common Stock,4751304735.0,Consumer Discretionary,Other Specialty Stores,,,,,,,,,,,,,,,,,,,,,,,,,,,,,,,,,,,,,,,,,,,,,,,,,,,,,,,,,,,,,,,,,
RHE,Regional Health Properties Inc. Common Stock,3880533.0,Real Estate,Real Estate,,,,,,,,,,,,,,,,,,,,,,,,,,,,,,,,,,,,,,,,,,,,,,,,,,,,,,,,,,,,,,,,,
RHI,Robert Half Inc. Common Stock,6581574131.0,Consumer Discretionary,Professional Services,,,,,,,,,,,,,,,,,,,,,,,,,,,,,,,,,,,,,,,,,,,,,,,,,,,,,,,,,,,,,,,,,
RHP,Ryman Hospitality Properties Inc. (REIT),5965083143.0,Real Estate,Real Estate Investment Trusts,,,,,,,,,,,,,,,,,,,,,,,,,,,,,,,,,,,,,,,,,,,,,,,,,,,,,,,,,,,,,,,,,
RICK,RCI Hospitality Holdings Inc. Common Stock,417765242.0,Consumer Discretionary,Restaurants,,,,,,,,,,,,,,,,,,,,,,,,,,,,,,,,,,,,,,,,,,,,,,,,,,,,,,,,,,,,,,,,,
RIG,Transocean Ltd (Switzerland) Common Stock,4261814258.0,Energy,Oil & Gas Production,,,,,,,,,,,,,,,,,,,,,,,,,,,,,,,,,,,,,,,,,,,,,,,,,,,,,,,,,,,,,,,,,
RIGL,Rigel Pharmaceuticals Inc. Common Stock,170315452.0,Health Care,Biotechnology: Pharmaceutical Preparations,,,,,,,,,,,,,,,,,,,,,,,,,,,,,,,,,,,,,,,,,,,,,,,,,,,,,,,,,,,,,,,,,
RILY,B. Riley Financial Inc. Common Stock,551677468.0,Finance,Investment Managers,,,,,,,,,,,,,,,,,,,,,,,,,,,,,,,,,,,,,,,,,,,,,,,,,,,,,,,,,,,,,,,,,
RILYG,B. Riley Financial Inc. 5.00% Senior Notes due 2026,537741628.0,Finance,Investment Managers,,,,,,,,,,,,,,,,,,,,,,,,,,,,,,,,,,,,,,,,,,,,,,,,,,,,,,,,,,,,,,,,,
RILYK,B. Riley Financial Inc. 5.50% Senior Notes Due 2026,641654518.0,Finance,Investment Managers,,,,,,,,,,,,,,,,,,,,,,,,,,,,,,,,,,,,,,,,,,,,,,,,,,,,,,,,,,,,,,,,,
RILYL,B. Riley Financial Inc. Depositary Shares each representing 1/1000th in a share of 7.375% Series B Cumulative Perpetual Preferred Stock par value $0.0001,620144852.0,Finance,Investment Managers,,,,,,,,,,,,,,,,,,,,,,,,,,,,,,,,,,,,,,,,,,,,,,,,,,,,,,,,,,,,,,,,,
RILYM,B. Riley Financial Inc. 6.375% Senior Notes due 2025,729813849.0,Finance,Investment Managers,,,,,,,,,,,,,,,,,,,,,,,,,,,,,,,,,,,,,,,,,,,,,,,,,,,,,,,,,,,,,,,,,
RILYN,B. Riley Financial Inc. 6.50% Senior Notes Due 2026,567128072.0,Finance,Investment Managers,,,,,,,,,,,,,,,,,,,,,,,,,,,,,,,,,,,,,,,,,,,,,,,,,,,,,,,,,,,,,,,,,
RILYP,B. Riley Financial Inc. Depositary Shares each representing a 1/1000th fractional interest in a share of Series A Cumulative Perpetual Preferred Stock,545315454.0,Finance,Investment Managers,,,,,,,,,,,,,,,,,,,,,,,,,,,,,,,,,,,,,,,,,,,,,,,,,,,,,,,,,,,,,,,,,
RILYT,B. Riley Financial Inc. 6.00% Senior Notes Due 2028,526532366.0,Finance,Investment Managers,,,,,,,,,,,,,,,,,,,,,,,,,,,,,,,,,,,,,,,,,,,,,,,,,,,,,,,,,,,,,,,,,
RILYZ,B. Riley Financial Inc. 5.25% Senior Notes due 2028,443826189.0,Finance,Investment Managers,,,,,,,,,,,,,,,,,,,,,,,,,,,,,,,,,,,,,,,,,,,,,,,,,,,,,,,,,,,,,,,,,
RIO,Rio Tinto Plc Common Stock,103597986225.0,Basic Materials,Metal Mining,,,,,,,,,,,,,,,,,,,,,,,,,,,,,,,,,,,,,,,,,,,,,,,,,,,,,,,,,,,,,,,,,
RIOT,Riot Platforms Inc. Common Stock ,2601201254.0,Finance,Finance: Consumer Services,,,,,,,,,,,,,,,,,,,,,,,,,,,,,,,,,,,,,,,,,,,,,,,,,,,,,,,,,,,,,,,,,
RITM,Rithm Capital Corp. Common Stock,5400446054.0,Real Estate,Real Estate Investment Trusts,,,,,,,,,,,,,,,,,,,,,,,,,,,,,,,,,,,,,,,,,,,,,,,,,,,,,,,,,,,,,,,,,
RIVN,Rivian Automotive Inc. Class A Common Stock,14651113815.0,Consumer Discretionary,Auto Manufacturing,,,,,,,,,,,,,,,,,,,,,,,,,,,,,,,,,,,,,,,,,,,,,,,,,,,,,,,,,,,,,,,,,
RJF,Raymond James Financial Inc. Common Stock,22593167712.0,Finance,Investment Bankers/Brokers/Service,,,,,,,,,,,,,,,,,,,,,,,,,,,,,,,,,,,,,,,,,,,,,,,,,,,,,,,,,,,,,,,,,
RKDA,Arcadia Biosciences Inc. Common Stock,3652411.0,Consumer Staples,Farming/Seeds/Milling,,,,,,,,,,,,,,,,,,,,,,,,,,,,,,,,,,,,,,,,,,,,,,,,,,,,,,,,,,,,,,,,,
RKLB,Rocket Lab USA Inc. Common Stock,2370270434.0,Industrials,Military/Government/Technical,,,,,,,,,,,,,,,,,,,,,,,,,,,,,,,,,,,,,,,,,,,,,,,,,,,,,,,,,,,,,,,,,
RKT,Rocket Companies Inc. Class A Common Stock,34299136222.0,Finance,Finance: Consumer Services,,,,,,,,,,,,,,,,,,,,,,,,,,,,,,,,,,,,,,,,,,,,,,,,,,,,,,,,,,,,,,,,,
RL,Ralph Lauren Corporation Common Stock,10276549634.0,Consumer Discretionary,Apparel,,,,,,,,,,,,,,,,,,,,,,,,,,,,,,,,,,,,,,,,,,,,,,,,,,,,,,,,,,,,,,,,,
RLAY,Relay Therapeutics Inc. Common Stock,1012818996.0,Health Care,Biotechnology: Biological Products (No Diagnostic Substances),,,,,,,,,,,,,,,,,,,,,,,,,,,,,,,,,,,,,,,,,,,,,,,,,,,,,,,,,,,,,,,,,
RLGT,Radiant Logistics Inc. Common Stock,266032118.0,Consumer Discretionary,Oil Refining/Marketing,,,,,,,,,,,,,,,,,,,,,,,,,,,,,,,,,,,,,,,,,,,,,,,,,,,,,,,,,,,,,,,,,
RLI,RLI Corp. Common Stock (DE),6846811902.0,Finance,Property-Casualty Insurers,,,,,,,,,,,,,,,,,,,,,,,,,,,,,,,,,,,,,,,,,,,,,,,,,,,,,,,,,,,,,,,,,
RLJ,RLJ Lodging Trust Common Shares of Beneficial Interest $0.01 par value,1437403550.0,Real Estate,Real Estate Investment Trusts,,,,,,,,,,,,,,,,,,,,,,,,,,,,,,,,,,,,,,,,,,,,,,,,,,,,,,,,,,,,,,,,,
RLMD,Relmada Therapeutics Inc. Common Stock,108627127.0,Health Care,Biotechnology: Pharmaceutical Preparations,,,,,,,,,,,,,,,,,,,,,,,,,,,,,,,,,,,,,,,,,,,,,,,,,,,,,,,,,,,,,,,,,
RLX,RLX Technology Inc. American Depositary Shares each representing the right to receive one (1) Class A ordinary share,2654636063.0,Health Care, Medicinal Chemicals and Botanical Products ,,,,,,,,,,,,,,,,,,,,,,,,,,,,,,,,,,,,,,,,,,,,,,,,,,,,,,,,,,,,,,,,,
RLYB,Rallybio Corporation Common Stock,52226114.0,Health Care,Biotechnology: Pharmaceutical Preparations,,,,,,,,,,,,,,,,,,,,,,,,,,,,,,,,,,,,,,,,,,,,,,,,,,,,,,,,,,,,,,,,,
RM,Regional Management Corp. Common Stock,298667316.0,Finance,Finance: Consumer Services,,,,,,,,,,,,,,,,,,,,,,,,,,,,,,,,,,,,,,,,,,,,,,,,,,,,,,,,,,,,,,,,,
RMAX,RE/MAX Holdings Inc. Class A Common Stock,173069246.0,Finance,Real Estate,,,,,,,,,,,,,,,,,,,,,,,,,,,,,,,,,,,,,,,,,,,,,,,,,,,,,,,,,,,,,,,,,
RMBI,Richmond Mutual Bancorporation Inc. Common Stock,134555981.0,Finance,Major Banks,,,,,,,,,,,,,,,,,,,,,,,,,,,,,,,,,,,,,,,,,,,,,,,,,,,,,,,,,,,,,,,,,
RMBL,RumbleOn Inc. Class B Common Stock,135387802.0,Technology,EDP Services,,,,,,,,,,,,,,,,,,,,,,,,,,,,,,,,,,,,,,,,,,,,,,,,,,,,,,,,,,,,,,,,,
RMBS,Rambus Inc. Common Stock,4533335325.0,Technology,Semiconductors,,,,,,,,,,,,,,,,,,,,,,,,,,,,,,,,,,,,,,,,,,,,,,,,,,,,,,,,,,,,,,,,,
RMCF,Rocky Mountain Chocolate Factory Inc. Common Stock,9702640.0,Consumer Staples,Specialty Foods,,,,,,,,,,,,,,,,,,,,,,,,,,,,,,,,,,,,,,,,,,,,,,,,,,,,,,,,,,,,,,,,,
RMCO,Royalty Management Holding Corporation Class A Common Stock,13841788.0,Miscellaneous,Multi-Sector Companies,,,,,,,,,,,,,,,,,,,,,,,,,,,,,,,,,,,,,,,,,,,,,,,,,,,,,,,,,,,,,,,,,
RMCOW,Royalty Management Holding Corporation Warrant,255886.0,Miscellaneous,Multi-Sector Companies,,,,,,,,,,,,,,,,,,,,,,,,,,,,,,,,,,,,,,,,,,,,,,,,,,,,,,,,,,,,,,,,,
RMD,ResMed Inc. Common Stock,32854327773.0,Health Care,Medical/Dental Instruments,,,,,,,,,,,,,,,,,,,,,,,,,,,,,,,,,,,,,,,,,,,,,,,,,,,,,,,,,,,,,,,,,
RMI,RiverNorth Opportunistic Municipal Income Fund Inc. Common Stock,102099753.0,Finance,Finance/Investors Services,,,,,,,,,,,,,,,,,,,,,,,,,,,,,,,,,,,,,,,,,,,,,,,,,,,,,,,,,,,,,,,,,
RMM,RiverNorth Managed Duration Municipal Income Fund Inc. Common Stock,303398082.0,Finance,Trusts Except Educational Religious and Charitable,,,,,,,,,,,,,,,,,,,,,,,,,,,,,,,,,,,,,,,,,,,,,,,,,,,,,,,,,,,,,,,,,
RMMZ,RiverNorth Managed Duration Municipal Income Fund II Inc. Common Stock,316426237.0,Finance,Investment Managers,,,,,,,,,,,,,,,,,,,,,,,,,,,,,,,,,,,,,,,,,,,,,,,,,,,,,,,,,,,,,,,,,
RMNI,Rimini Street Inc. (DE) Common Stock,177318500.0,Consumer Discretionary,Business Services,,,,,,,,,,,,,,,,,,,,,,,,,,,,,,,,,,,,,,,,,,,,,,,,,,,,,,,,,,,,,,,,,
RMR,The RMR Group Inc. Class A Common Stock,795169563.0,Consumer Discretionary,Professional Services,,,,,,,,,,,,,,,,,,,,,,,,,,,,,,,,,,,,,,,,,,,,,,,,,,,,,,,,,,,,,,,,,
RMT,Royce Micro-Cap Trust Inc. Common Stock,431228077.0,Finance,Investment Managers,,,,,,,,,,,,,,,,,,,,,,,,,,,,,,,,,,,,,,,,,,,,,,,,,,,,,,,,,,,,,,,,,
RMTI,Rockwell Medical Inc. Common Stock,53355604.0,Health Care,Biotechnology: Pharmaceutical Preparations,,,,,,,,,,,,,,,,,,,,,,,,,,,,,,,,,,,,,,,,,,,,,,,,,,,,,,,,,,,,,,,,,
RNA,Avidity Biosciences Inc. Common Stock,3946928590.0,Health Care,Biotechnology: Pharmaceutical Preparations,,,,,,,,,,,,,,,,,,,,,,,,,,,,,,,,,,,,,,,,,,,,,,,,,,,,,,,,,,,,,,,,,
